drama_type,speaker,sex,job,job_category,social_class,text,progress,short_name
comedy,Hortense,F,,,,"Mon Dieu wie bin ich unglüecklich.|||Ken Mensch wo aane tröscht. Gott wie min Hochzittsnastüechel tropft.|||Träne, nix wie Träne.",0,bastian-e-sportschochzitt
comedy,Octavie,M,,,,"Bonjour Hortense, glüecklichi Hochzittere! Loss dich umarme. Ja, was muess ich sehne? Dü griensch?",0,bastian-e-sportschochzitt
comedy,Hortense,F,,,,Bonjour Tante Octavie.,1,bastian-e-sportschochzitt
comedy,Octavie,M,,,,Was isch denn basiert?,1,bastian-e-sportschochzitt
comedy,Hortense,F,,,,D'r Camille isch noch nit do.,2,bastian-e-sportschochzitt
comedy,Octavie,M,,,,"Diner Hochzitter? Ah, nit möjlich! Kumm setz dich.",2,bastian-e-sportschochzitt
comedy,Hortense,F,,,,"In e're Halbstund solle mer uff d' Mairie, derno in d'Kirich. Ich verzwiefel noch.",3,bastian-e-sportschochzitt
comedy,Octavie,M,,,,"Na, ja, er wurd schun kumme. Tröscht dich. Viellicht isch-em e Hosseknopf abgschprunge, odder er het d'Krawatt verlajt, odder....",3,bastian-e-sportschochzitt
comedy,Hortense,F,,,,So ebbs soll am eso e Daa nit vorkumme.,4,bastian-e-sportschochzitt
comedy,Octavie,M,,,,Biem e Junggsell isch alles möjlich.,4,bastian-e-sportschochzitt
comedy,Hortense,F,,,,"O, ich sitz wie uff-em e Kohlefyr.|||Bedenk, tante, wenn'r nit käm. Die Blamasch. Ich gäng direkt...",5,bastian-e-sportschochzitt
comedy,Octavie,M,,,,In's Wasser?,5,bastian-e-sportschochzitt
comedy,Hortense,F,,,,"Naan, in's Kloschter. Tante Octavie, hirot nit, hirot nit. Betracht mich in mim grenzelose Ku-kummer. Näm dir e lawendigs Exempel an mir.",6,bastian-e-sportschochzitt
comedy,Octavie,M,,,,In die Verläjeheit wurr ich nie kumme.,6,bastian-e-sportschochzitt
comedy,Hortense,F,,,,"Jo mach Sache. Dü bisch jo erscht in de vierzig, odder?",7,bastian-e-sportschochzitt
comedy,Octavie,M,,,,Was waisch denn dü vom Läwe. Ach Gott.,7,bastian-e-sportschochzitt
comedy,Hortense,F,,,,Werum sifzsch denn eso?,8,bastian-e-sportschochzitt
comedy,Octavie,M,,,,"Hab ich gsifzt? Hortensele, ich hab mir gschwore nie ze hirote. E Mann bringt aam nix wie Sorje un Unglüeck.",8,bastian-e-sportschochzitt
comedy,Hortense,F,,,,"Awer Tante, wie reddsch denn dü?",9,bastian-e-sportschochzitt
comedy,Octavie,M,,,,Bsunders e Mann wo Sport triebt.|||Ich warn dich vor so 'me Mann.,9,bastian-e-sportschochzitt
comedy,Hortense,F,,,,"Tante, er het mir awer versproche, dass'r üss alle Societäte...",10,bastian-e-sportschochzitt
comedy,Octavie,M,,,,"Bscht! Verspreche duehn sie alli, awer nix halte. Dü nadierlich mit dine zwanzig Johr, dü luejsch d'Männerwelt noch mit unschuldige Paradiesaue aan.",10,bastian-e-sportschochzitt
comedy,Hortense,F,,,,"Statt aane ze tröschte, machsch aam 's Herz noch schwerer. O ich armer Tropf.",11,bastian-e-sportschochzitt
comedy,Octavie,M,,,,"Düürsch mich, Kind, awer ich bin uffrichtig. So e Mann het jo nie ken Zitt for sini Frau, d'r Sport isch ihm alles, alles! So e Mann isch nie d'haame, un am End vum Johr het'r e Korb voll Cotisatione ze zahle, wo d'Frau nix d'rvun het.",11,bastian-e-sportschochzitt
comedy,Hortense,F,,,,Awer d'r Sport isch doch ebbs gesunds.,12,bastian-e-sportschochzitt
comedy,Octavie,M,,,,Ebbs gsunds? Mach mich nit lache.,12,bastian-e-sportschochzitt
comedy,Hortense,F,,,,"Doch, doch. Sitter dass d'r Camille zue uns kummt, isch bie uns alles gsund.",13,bastian-e-sportschochzitt
comedy,Octavie,M,,,,"Ah, do bin ich awer gschbannt.",13,bastian-e-sportschochzitt
comedy,Hortense,F,,,,"Im Babbe siner Fettbüch hett-em Maläschte gemacht. D'r Camille het gsaat: Babbe mache Sie Gymnastique, ich lehr Sie. Sie wäre sehn, Sie greje e Taille wie e Weschbel; d'Mame het allewiel weh in de Baan g'hett. D'r Camille het sie Velo fahre lehre. Un 's Weh isch eweck. D'Grossmame, wo dato siewezig Johr alt isch, die isch allegelte an Kritzbuckelschmerze im Bett geläje. D'r Camille het e're gerote mit yserige|||Hantle un an de Ring ze schaffe. Jetzt geht sie kerzegrad, un isch ganz buschberlig.",14,bastian-e-sportschochzitt
comedy,Octavie,M,,,,"Also demnooch het's diner Camille fertig gebrocht, d'ganz Familli mit-em Sportsgaischt ze vergifte. Naan, so ebbs. Ja un was het'r denn dich gelehrt?",14,bastian-e-sportschochzitt
comedy,Hortense,F,,,,Tennis.,15,bastian-e-sportschochzitt
comedy,Octavie,M,,,,Jesses! Arms Kind.,15,bastian-e-sportschochzitt
comedy,Hortense,F,,,,Um's Gottswille! Tante! Tante!,16,bastian-e-sportschochzitt
comedy,Octavie,M,,,,"Tennis! Tennis! Diss isch din Unglüeck. Mit Tennis het's bie mir angfange, mit Tennis het's uffg'hört.",16,bastian-e-sportschochzitt
comedy,Hortense,F,,,,"Tante, ich versteh dich nit. Kumm doch zue dir. Soll ich e Glas Wasser hole?",17,bastian-e-sportschochzitt
comedy,Octavie,M,,,,"Merci, ich hab mini Ohnmacht nabgschluckt.|||Oh! Was muess ich sehn? D'r Schwöjer hängt im Garte am Reck! O, jetzt macht'r Büchwelle. Conrad! Conrad, dü verdräjsch dir jo d'r Blinddarm. Conrad! Halt! Jetzt macht'r d'r Rieseschwung. Der brecht sich noch's Gnick. Ich kann's nim sehn.",17,bastian-e-sportschochzitt
comedy,Octavie,M,,,,Was poltert denn so?,18,bastian-e-sportschochzitt
comedy,Hortense,F,,,,"Nix, d'Grossmame schafft im Näwetszimmer mit de Hantle.",18,bastian-e-sportschochzitt
comedy,Octavie,M,,,,"Naan, so ebbs verruckts.",19,bastian-e-sportschochzitt
comedy,Hortense,F,,,,"Saa, Tante, werum soll Tennis e Unglüeck sin?",19,bastian-e-sportschochzitt
comedy,Octavie,M,,,,"Kind, ich bin uffrichtig. Wie ich so alt bin gsin wie dü, hab ich au e Hochzitter g'hett. Gaston het'r g'haisse. Gaston!",20,bastian-e-sportschochzitt
comedy,Hortense,F,,,,"Ah! Verzehl, verzehl!",20,bastian-e-sportschochzitt
comedy,Octavie,M,,,,"Ja, un er het mir versproche, dass wenn mer g'hirot sin, bie alle Sportsveraan Demission ze gänn.",21,bastian-e-sportschochzitt
comedy,Hortense,F,,,,Diss het miner Camille au versproche.,21,bastian-e-sportschochzitt
comedy,Octavie,M,,,,"Glaub nix. Bref, am Daa vor d'r Hochzitt isch'r nooch London gereist, for dort e Tennismatch mitzemache. E Depesch het'r gschickt: Weltmaischter worre",22,bastian-e-sportschochzitt
comedy,Hortense,F,,,,O — o! Isch'r nim kumme?,22,bastian-e-sportschochzitt
comedy,Octavie,M,,,,Un so wurd's dir au gehn.,23,bastian-e-sportschochzitt
comedy,Hortense,F,,,,"Tante, saa diss nim, sunscht verriss ich min Hochzittskleid in döüsig Fetze.",23,bastian-e-sportschochzitt
comedy,Octavie,M,,,,"Verriss-es. Besser eso, als Sportsfrau ze sin.",24,bastian-e-sportschochzitt
comedy,Hortense,F,,,,Jesses!,24,bastian-e-sportschochzitt
comedy,Octavie,M,,,,Was isch denn?,25,bastian-e-sportschochzitt
comedy,Hortense,F,,,,"d'Grossmame schafft an de Ring. Sie het e Hochstand gemacht, un isch an de Lüster getrette.",25,bastian-e-sportschochzitt
comedy,Octavie,M,,,,"An de Lüster? Püh, do hinne wurd's mer schwüel, ich muess frischi Luft schöpfe.",26,bastian-e-sportschochzitt
comedy,Hortense,F,,,,"Camille, Camille, kumm, erlös mich, loss mich nit sitze.",26,bastian-e-sportschochzitt
comedy,Octavie,M,,,,"Ho-ho-hortense, e De-depesch.|||Da, mach dü sie uff.",27,bastian-e-sportschochzitt
comedy,Hortense,F,,,,"E Depesch? E de-de|||Ich kann nit, ich rieder. Tante les, mach sie uff.",27,bastian-e-sportschochzitt
comedy,Octavie,M,,,,E Unglüecksdepesch? Arms Kind.,28,bastian-e-sportschochzitt
comedy,Conrad,M,,,,"Was isch denn?|||he Hortense!|||Octavie, was isch denn mit euch?",28,bastian-e-sportschochzitt
comedy,Octavie,M,,,,Zwai Jumpfere han zwai Ohnmachte.,29,bastian-e-sportschochzitt
comedy,Conrad,M,,,,"Plän dummi. Was hesch denn in d'r Hand? Ah, e Depesch.|||Je viens par Avion avec mon ami Gaston. Paris. Camille. Er kummt per Avion. So e Deifelskerl.",29,bastian-e-sportschochzitt
comedy,Hortense,F,,,,"Per Avion? Babbe, per Avion?",30,bastian-e-sportschochzitt
comedy,Octavie,M,,,,Wer isch der ami Gaston? Wer?,30,bastian-e-sportschochzitt
comedy,Hortense,F,,,,"Er kummt, er kummt. Babbe werf dich in de Staat. Gott, miner Camille kummt.",31,bastian-e-sportschochzitt
comedy,Conrad,M,,,,"Hortense, ich glaab dü bisch maschugge worre.",31,bastian-e-sportschochzitt
comedy,Octavie,M,,,,"Saa, wer isch der Gaston? Redd!",32,bastian-e-sportschochzitt
comedy,Conrad,M,,,,Was waiss denn ich.,32,bastian-e-sportschochzitt
comedy,Octavie,M,,,,"Hortense, kennsch dü 'ne, denne Gaston?",33,bastian-e-sportschochzitt
comedy,Hortense,F,,,,Ich kenn numme miner Camille. Mach doch nit so nervös.,33,bastian-e-sportschochzitt
comedy,Octavie,M,,,,"Gaston! Amend, wer waiss. So het'r g'haisse, der wo mich Tennis gelehrt het.",34,bastian-e-sportschochzitt
comedy,Hortense,F,,,,"Liebs Dandel, ich bin so glüecklich. Er kummt, er kummt, er isch schun do. Ich kenn siner Schritt.",34,bastian-e-sportschochzitt
comedy,Caroline,F,,,,"Bonjour, bonjour.",35,bastian-e-sportschochzitt
comedy,Hortense,F,,,,"Oh, d'Madam.",35,bastian-e-sportschochzitt
comedy,Caroline,F,,,,"Ja, soll ich's nit sin? Luej do 's Octavie.",36,bastian-e-sportschochzitt
comedy,Octavie,M,,,,Bonjour Schweschter.|||Dü siehsch jo üss wie e Mann.,36,bastian-e-sportschochzitt
comedy,Caroline,F,,,,Bisch denn als noch so altfränkisch? So altjumpferlich?,37,bastian-e-sportschochzitt
comedy,Hortense,F,,,,"Mame, d'r Camille kummt.",37,bastian-e-sportschochzitt
comedy,Caroline,F,,,,Was hab ich gsaat: d'r Camille het e Wort.,38,bastian-e-sportschochzitt
comedy,Hortense,F,,,,"Jaja, Mamele, geh, dueh dich aan, dummel dich.",38,bastian-e-sportschochzitt
comedy,Octavie,M,,,,"Gott, wenn 'rs wär. Min Herz klopft wie e Drumm.",39,bastian-e-sportschochzitt
comedy,Caroline,F,,,,Was babbelsch? Hesch dü Gschäfte mit-em Camille?,39,bastian-e-sportschochzitt
comedy,Octavie,M,,,,"Caroline, wenn dü widder e Frau bisch, redd ich mit dir.",40,bastian-e-sportschochzitt
comedy,Caroline,F,,,,Versteh ken Wort.,40,bastian-e-sportschochzitt
comedy,Hortense,F,,,,Entrez!,41,bastian-e-sportschochzitt
comedy,Président vum Fuessballe-Club « Etoile »,M,sports_club_president,associative_world,,"Hochverehrts Hochzittspaar — pardon, wo isch d'r Camille?",41,bastian-e-sportschochzitt
comedy,Hortense,F,,,,Er wurd im Moment do sin.,42,bastian-e-sportschochzitt
comedy,Président vum Fuessballe-Club « Etoile »,M,sports_club_president,associative_world,,"Pardon, ich bin starik bresiert. Im Name vum Füessballe-Club «Etoile» wüensch ich Ihne, un im verdiente membre Camille viel Glüeck zuem hittige Fraidedaa, un|||Zuem verehrungsvolle Zaiche|||Dueh ich denne Balle üewerreiche,|||Möcht er bringe Glüeck un Säje,|||D'Haam, un alle Fuessballwäje.",42,bastian-e-sportschochzitt
comedy,Hortense,F,,,,"Merci, Monsieur le Président. Ich wurr denne Balle im Camille an's Herz drücke.",43,bastian-e-sportschochzitt
comedy,Président vum Fuessballe-Club « Etoile »,M,sports_club_president,associative_world,,Un d'r Camille au.|||Bin starik bressiert.|||Hipp-hipp-Hurra!,43,bastian-e-sportschochzitt
comedy,Octavie,M,,,,"Siehsch, alli sin bressiert.",44,bastian-e-sportschochzitt
comedy,Hortense,F,,,,Entrez!,44,bastian-e-sportschochzitt
comedy,Président vum Fuessballe-Club « Etoile »,M,sports_club_president,associative_world,,"Mesdames! Im Uffdraa vun d'r Société de Gymnastique « Vivace », hab ich die Ehr als Président im junge Paar — wo isch denn 's ander Teil vum Paar? — herzliche Glüeckwüensch zu üewerbringe. 's Comité het bschlosse d'r lieb Hors-concours Camille als membre d'honneur ze ernenne, un d'membres vun d'r Societät han im Camille als chef vun d'r Claironsektion diss Clairon gschtift. 's Comité hofft, dass Sie, ihri Kinder un Kindeskinder membre actif wäre.|||Denn d'Gymnastik macht starki Glidder,|||Un Nerve grad wie Stacheldroht,|||Vor d'Gymnasiens förcht sich's Gewitter,|||In viele Fäll sogar d'r Tod.",45,bastian-e-sportschochzitt
comedy,Hortense,F,,,,Merci vielmols Monsieur le Président. Ich wurr alles im Camille üssrichte.,45,bastian-e-sportschochzitt
comedy,Président vum Fuessballe-Club « Etoile »,M,sports_club_president,associative_world,,"Exküsiere Sie liewi Hochzittere, ich hab noch schnell e Concours ze organisiere.",46,bastian-e-sportschochzitt
comedy,Octavie,M,,,,"Der isch au bressiert. M'r maant alli han 's Laufe. Naan, so e Theater.|||Wo blost mer denn nyn?",46,bastian-e-sportschochzitt
comedy,Hortense,F,,,,"Gib her, ich will dir's zaje.",47,bastian-e-sportschochzitt
comedy,Octavie,M,,,,Hortense dü wursch doch nit!,47,bastian-e-sportschochzitt
comedy,Hortense,F,,,,Was mich d'r Camille gelehrt het!,48,bastian-e-sportschochzitt
comedy,Octavie,M,,,,Hör uff!,48,bastian-e-sportschochzitt
comedy,Octavie,M,,,,,49,bastian-e-sportschochzitt
comedy,Conrad,M,,,,Was isch denn diss for e Grambol?,49,bastian-e-sportschochzitt
comedy,Hortense,F,,,,"Herrjeses! Babbe, dü hesch jo dini Hosse vergesse.",50,bastian-e-sportschochzitt
comedy,Conrad,M,,,,"Was d'Hosse?|||E Nundebibb! So isch's, wenn mer sich dummelt.",50,bastian-e-sportschochzitt
comedy,Octavie,M,,,,Grossmame hör uff!|||In dem Hüss isch alles letz.,51,bastian-e-sportschochzitt
comedy,Grossmame,F,,,,"Mit Müsik isch's viel besser gange.|||Au, miner gross Zeh",51,bastian-e-sportschochzitt
comedy,Hortense,F,,,,Un d'r Camille isch als noch nit do.,52,bastian-e-sportschochzitt
comedy,Octavie,M,,,,"Gschbannt bin ich, wer jetzt kummt.",52,bastian-e-sportschochzitt
comedy,Hortense,F,,,,Entrez!,53,bastian-e-sportschochzitt
comedy,Président vum Fuessballe-Club « Etoile »,M,sports_club_president,associative_world,,"Bonjour.|||Mesdames, hm, wo isch d'r Camille?",53,bastian-e-sportschochzitt
comedy,Octavie,M,,,,Er bambelt noch in d'r Luft.,54,bastian-e-sportschochzitt
comedy,Président vum Fuessballe-Club « Etoile »,M,sports_club_president,associative_world,,"Was, er bambelt? Enfin, Gschbass uff d'Sitt. In aller Anerkennung vum Camille sine Mérites am Velo-Club « Blitz », hab ich die gross Ehr, Ihne Mademoiselle Hortense zuem küenftige Ehestandsglüeck ze gratüliere, un im Name vum Club, im ehrewerte membre Camille e Velo ze üewerreiche, mit dem Wunsch, dass er mit dem Velo in's Glüeck nynstrample, un im Club e trej's Mitglied bliewe möcht.",54,bastian-e-sportschochzitt
comedy,Hortense,F,,,,Merci vielmols im Name vum — o ich bin ganz gerüehrt.,55,bastian-e-sportschochzitt
comedy,Président vum Fuessballe-Club « Etoile »,M,sports_club_president,associative_world,,"Mer kann's verstehn. Ja, ich muess gehn, ich bin bressiert.|||Au revoir Mesdames. (ab).",55,bastian-e-sportschochzitt
comedy,Octavie,M,,,,"Haha, der isch au bressiert. Awer wenn's eso wittersch geht, no kannsch e Sportsgschäft anfange.",56,bastian-e-sportschochzitt
comedy,Hortense,F,,,,"Es isch doch schön, so g'eehrt ze wäre, gell, tante.",56,bastian-e-sportschochzitt
comedy,Octavie,M,,,,'s kummt druff aan.,57,bastian-e-sportschochzitt
comedy,Hortense,F,,,,Gell dü bisch niedisch uff mich?,57,bastian-e-sportschochzitt
comedy,Octavie,M,,,,Ich? Merci. In wieviel Societäte isch denn diner Allerwelts-Camille?,58,bastian-e-sportschochzitt
comedy,Octavie,M,,,,Es het schun widder geklopft: Entrez!,58,bastian-e-sportschochzitt
comedy,Hortense,F,,,,Entrez s'il vous plait.,59,bastian-e-sportschochzitt
comedy,Président vum Fuessballe-Club « Etoile »,M,sports_club_president,associative_world,,Tüer uff wenn's beliebt.,59,bastian-e-sportschochzitt
comedy,Octavie,M,,,,'s wurd doch kener mit 'me Haiwaaue kumme.,60,bastian-e-sportschochzitt
comedy,Hortense,F,,,,Entrez!,60,bastian-e-sportschochzitt
comedy,Président vum Fuessballe-Club « Etoile »,M,sports_club_president,associative_world,,E Bojongrüess vum Athlete-Club.|||Voilà.,61,bastian-e-sportschochzitt
comedy,Octavie,M,,,,"Monsieur, was soll denn diss bedidde?",61,bastian-e-sportschochzitt
comedy,Président vum Fuessballe-Club « Etoile »,M,sports_club_president,associative_world,,"Zwai Schwergewicht for unser Schwergewichsstemmer Camille, zuem ewige Andenke als Hochzittsgschenk vum Athlete-Club « Bojon ». Mamsell Hochzittere, wenn Sie emol Dischbetat han mit-em Camille, saaue Sie nix, stemme Sie die zwai Gewichtle, un Ihrer Röüjes isch verschwunde. Kraft üewerwind alles, Kraft macht rich an Körper un Seel, Kraft isch Läwe, Kraft üewerwind alles, sogar e Frau.",62,bastian-e-sportschochzitt
comedy,Octavie,M,,,,"Vergesse Sie nit unsri Zung, wo au e Kraft isch, un 's guete Koche.",62,bastian-e-sportschochzitt
comedy,Hortense,F,,,,Bravo tante. Hahaha!,63,bastian-e-sportschochzitt
comedy,Président vum Fuessballe-Club « Etoile »,M,sports_club_president,associative_world,,"Lache Sie nit, Mamsel Hochzittere. Ich bin au g'hirot, hab sechs Kinder, alli gsund, alli stemme. Ich wüensch Ihne 's nämlich.",63,bastian-e-sportschochzitt
comedy,Hortense,F,,,,"O, diss isch e bissel viel.",64,bastian-e-sportschochzitt
comedy,Président vum Fuessballe-Club « Etoile »,M,sports_club_president,associative_world,,"Wie Sie wôlle. Awer mir laischte ebbs. Union fait la force. Ha, diss will ich maane. Un do bin ich stolz druff.",64,bastian-e-sportschochzitt
comedy,Octavie,M,,,,Mir gratüliere.,65,bastian-e-sportschochzitt
comedy,Hortense,F,,,,"Un au zue denne viele Medaill, wo Ihri Bruscht ziere.",65,bastian-e-sportschochzitt
comedy,Président vum Fuessballe-Club « Etoile »,M,sports_club_president,associative_world,,"Medaille? Die sin ehrlich verdient. Füenf Rettungsmedaill, un d'andere hab ich mir bie internationale Wettkämpf g'holt.",66,bastian-e-sportschochzitt
comedy,Octavie,M,,,,"Finde Sie nit, dass die viele Medaill gfährlich schwer sin?",66,bastian-e-sportschochzitt
comedy,Président vum Fuessballe-Club « Etoile »,M,sports_club_president,associative_world,,Kraft isch Läwe. Kraft üewerwind alles.,67,bastian-e-sportschochzitt
comedy,Hortense,F,,,,"Tante, wie der stolz abgange isch, der Kraftmensch, sogar ohne Bojongrüess.",67,bastian-e-sportschochzitt
comedy,Octavie,M,,,,Der Bojon-Président gfallt mer. Kraft! Kraft!,68,bastian-e-sportschochzitt
comedy,Président vum Fuessballe-Club « Etoile »,M,sports_club_president,associative_world,,"Fraid mich, dass ich Ihne gfall. Un wie ich au Président vum Angelsportsverein « Hechtekrähn » bin, so schenk ich dem junge Paar, zwai Gerte un e Filosch, im Gedanke, dass d'r Camille un Sie, au Membre vun unserem Angelveraan wäre.",68,bastian-e-sportschochzitt
comedy,Octavie,M,,,,"Hahaha, es wurd als besser.",69,bastian-e-sportschochzitt
comedy,Président vum Fuessballe-Club « Etoile »,M,sports_club_president,associative_world,,"Stimmt! Es wurd am besser in d'r freie Natür, statt d'haam in d'r Stubb ze sitze, un melancholische Gedanke noochzehenke; 's Fische isch e grenzeloses Vergnieje, es kalmiert Nerve, mer üebt sich in d'r Geduld, wenn mer stundelang uff's Zäpfel glüürt. E Biss, e Ruck un e Bräse, e Berschi, e Hecht, odder e Nas zawelt am Aengele. D'r Angelsport macht Fraid, bsunder s' halb zwait. Un wenn d'Fischbüechs garniert isch, geht's haamezues mit e're Bachet in Glüeck un Aanigkeit. Sie köenne rüehig 's Kinderkitschel als mitnämme, denn...",69,bastian-e-sportschochzitt
comedy,Octavie,M,,,,"Exküsiere Sie, mir muehn uns rüeschte for uff d'Mairie.",70,bastian-e-sportschochzitt
comedy,Président vum Fuessballe-Club « Etoile »,M,sports_club_president,associative_world,,"O, ich hab Zitt. Was gibt's denn ze esse?",70,bastian-e-sportschochzitt
comedy,Hortense,F,,,,Ich waiss-es nit!,71,bastian-e-sportschochzitt
comedy,Président vum Fuessballe-Club « Etoile »,M,sports_club_president,associative_world,,Sie wiss-es nit? Diss isch letz. Wo isch denn 's Hochzitts-Esse?,71,bastian-e-sportschochzitt
comedy,Hortense,F,,,,Ich glaab im Restaurant zuem « Wüetige Schimmel ».,72,bastian-e-sportschochzitt
comedy,Président vum Fuessballe-Club « Etoile »,M,sports_club_president,associative_world,,"Was? Viel Vergnieje. Na, Adie mit e'me Muskelgruess.",72,bastian-e-sportschochzitt
comedy,Hortense,F,,,,Merci vielmols for.... o — o!,73,bastian-e-sportschochzitt
comedy,Président vum Fuessballe-Club « Etoile »,M,sports_club_president,associative_world,,Viel Vergnieje Mamsell.,73,bastian-e-sportschochzitt
comedy,Octavie,M,,,,Merci! O Jesses! D'r Aanzig wo nit bressiert isch. O Jesses!,74,bastian-e-sportschochzitt
comedy,Président vum Fuessballe-Club « Etoile »,M,sports_club_president,associative_world,,« Im wüetige Schimmel ». Yhihi!,74,bastian-e-sportschochzitt
comedy,Hortense,F,,,,O mini Hand füenkelt wie Fyr. Merci for so e Kraft.,75,bastian-e-sportschochzitt
comedy,Octavie,M,,,,Denne Président vergesst mer so schnell nit.,75,bastian-e-sportschochzitt
comedy,Hortense,F,,,,Minsex.,76,bastian-e-sportschochzitt
comedy,Octavie,M,,,,Es isch doch schad um denne Mann.,76,bastian-e-sportschochzitt
comedy,Hortense,F,,,,Schad? Wieso.,77,bastian-e-sportschochzitt
comedy,Octavie,M,,,,"Wenn'r je 's Unglüeck het in's Wasser ze falle kummt'r nim in d'Höh, wäje sine schwere Rettungsmedaille.",77,bastian-e-sportschochzitt
comedy,Hortense,F,,,,Es zwirwelt mer alles im Kopf herum. Ich sieh fascht nix vor Schmerze.|||D'r Camille kummt!|||Camille!!,78,bastian-e-sportschochzitt
comedy,Président vum Fuessballe-Club « Etoile »,M,sports_club_president,associative_world,,"So haiss ich, chère Mademoiselle.",78,bastian-e-sportschochzitt
comedy,Hortense,F,,,,"Mon Dieu, ich, ich kenn Sie jo gar nit. Gott muess ich mich schämme.",79,bastian-e-sportschochzitt
comedy,Président vum Fuessballe-Club « Etoile »,M,sports_club_president,associative_world,,Gar nit notwendig Demoiselle.|||Président de l'Automobile-Club « Tour du monde ».,79,bastian-e-sportschochzitt
comedy,Octavie,M,,,,Monsieur.,80,bastian-e-sportschochzitt
comedy,Président vum Fuessballe-Club « Etoile »,M,sports_club_president,associative_world,,"Notre cher membre Camille a choisi une charmante Demoiselle. Mes félicitations de tout mon coeur.|||Je suis heureux de vous offrir au nom du Club, une Automobile comme cadeau de fiançailles. E Zwaisitzer, Mademoiselle, marque Renault. Drüsse steht der Waaue. Per-|||mettez que je vous embrasse.|||Et encore une fois mes meilleurs souhaits de bonheur.",80,bastian-e-sportschochzitt
comedy,Hortense,F,,,,Merci mille fois Monsieur le Président. Merci.,81,bastian-e-sportschochzitt
comedy,Président vum Fuessballe-Club « Etoile »,M,sports_club_president,associative_world,,,81,bastian-e-sportschochzitt
comedy,Octavie,M,,,,Was saasch jetzt?,82,bastian-e-sportschochzitt
comedy,Hortense,F,,,,Ich find ken Wort meh.,82,bastian-e-sportschochzitt
comedy,Octavie,M,,,,"E weritawels Auto als Hochzittsgschenk!? Voilà, diss loss ich mir jetzt gfalle. Nowel, was nowel heisst. Nowler als die Schwergewichter do, un Fischgerte.",83,bastian-e-sportschochzitt
comedy,Hortense,F,,,,"Gott was e Glüeck, so e Mann ze bekumme, wo So angsehne isch. Wo'r nume bliebt. O ich verzwazzel noch, ich fahr noch zue d'r Hütt nüss.",83,bastian-e-sportschochzitt
comedy,Octavie,M,,,,"Masch diss jo nitt, sunscht kummsch nimi nyn. E Moment, ich bin waier wunderfitzig uff denne Zwaisitzer.",84,bastian-e-sportschochzitt
comedy,Hortense,F,,,,"D'r Camille wurd Aue mache. Awer froh bin ich, dass miner Hochzitter ken so Bart het, wo aam im Gsicht erum grawelt.",84,bastian-e-sportschochzitt
comedy,Octavie,M,,,,,85,bastian-e-sportschochzitt
comedy,Hortense,F,,,,,85,bastian-e-sportschochzitt
comedy,Octavie,M,,,,Was saasch zue dem Zwaisitzer. Haha!,86,bastian-e-sportschochzitt
comedy,Hortense,F,,,,"O-o-o-o, so aane ze fobbe. Diss isch zeviel.",86,bastian-e-sportschochzitt
comedy,Octavie,M,,,,"Hortense, dü hesch e Chance wie selte. Haha!",87,bastian-e-sportschochzitt
comedy,Hortense,F,,,,Chance saasch dü?,87,bastian-e-sportschochzitt
comedy,Octavie,M,,,,"E chance, dass nit schun e Bubbel in d'r Kutsch lejt.",88,bastian-e-sportschochzitt
comedy,Hortense,F,,,,"Tante, verschon mich, es isch zeviel uff anmol.",88,bastian-e-sportschochzitt
comedy,Octavie,M,,,,"Ja, awer wenn mer's recht bedenkt — was nutzt dich e Kinderkütsch? Diner Zueküenftig isch jo nie d'haam!",89,bastian-e-sportschochzitt
comedy,Hortense,F,,,,"Ich lauf noch furt, dü ungattig tante, dass dü bisch.",89,bastian-e-sportschochzitt
comedy,Octavie,M,,,,"Bisch jetzt bös? Waisch was d'r Athlete-Président gsaat het? Wenn mer e Röüjes het, soll mer stemme. Kumm, helf, die Dinger muehn do eweck. Allez Hortense, hebb dich, Ho-hupp!",90,bastian-e-sportschochzitt
comedy,Hortense,F,,,,Ho-hupp!,90,bastian-e-sportschochzitt
comedy,Octavie,M,,,,Nachemol ho-hupp. Es geht nit.,91,bastian-e-sportschochzitt
comedy,Camille,M,athlete,professionals_scientific_technical,,Ho-hupp!!!,91,bastian-e-sportschochzitt
comedy,Gaston,M,aviator,professionals_scientific_technical,upper_middle_class,Ho-hupp!!!,92,bastian-e-sportschochzitt
comedy,Hortense,F,,,,Camille! Gottseidank!,92,bastian-e-sportschochzitt
comedy,Gaston,M,aviator,professionals_scientific_technical,upper_middle_class,,93,bastian-e-sportschochzitt
comedy,Octavie,M,,,,"Höre Sie, Monsieur, Sie kumme mir so bekannt vor. Ah, sin Sie nit der Herr wo mich zellemols Tennis gelehrt het?|||Bisch dü nit — Gaston! Miner Gaston! Hesch mich noch gern?",93,bastian-e-sportschochzitt
comedy,Gaston,M,aviator,professionals_scientific_technical,upper_middle_class,"Octavie, ich bin in d'r ganze Welt erumgflöüje, un jetzt fliehj ich in dini Aerm — uff ewig!",94,bastian-e-sportschochzitt
comedy,Octavie,M,,,,"Gaston, d'r Himmel hängt voll Bassgeje.",94,bastian-e-sportschochzitt
comedy,Camille,M,athlete,professionals_scientific_technical,,"Exküsier Hortense, ich hab noch schnell e Mätschel in Paris gemacht, un 30.000 Fränkle erüssgfuessballert.|||Hortense, luej dort, die zwai schiene sich ze kenne.",95,bastian-e-sportschochzitt
comedy,Hortense,F,,,,Jetzt schlaat's drizeh.,95,bastian-e-sportschochzitt
comedy,Gaston,M,aviator,professionals_scientific_technical,upper_middle_class,Mes amis — mini Hochzittere.,96,bastian-e-sportschochzitt
comedy,Octavie,M,,,,"Mir gehn mit uff d' Mairie, un fliehje in de Himmel; dummle Euch, es bressiert.",96,bastian-e-sportschochzitt
