drama_type,speaker,sex,job,job_category,social_class,text,progress,short_name
comedy,Otto Mobil,M,manufacturer,industry_and_transportation,upper_class,"Gratüliere, Herr Meyer, gratüliere !",141,clemens-a-latzi-visit
comedy,Jean,M,valet,elementary_professions,lower_class,|||Mir gratüliere au.,141,clemens-a-latzi-visit
comedy,Victor,M,military_man_(war_veteran),military,,|||Mir gratüliere au.,142,clemens-a-latzi-visit
comedy,Schakob,M,messenger/deliverer/helper,service_and_sales,lower_class,|||Mir gratüliere au.,142,clemens-a-latzi-visit
comedy,J. Meyer,M,insurance_inspector,intermediate_professionals,upper_middle_class,Bliewe mr numme vum Stand — Ihr — —,143,clemens-a-latzi-visit
comedy,Jean,M,valet,elementary_professions,lower_class,"Verzej-se uns, monsieur Meyer.",143,clemens-a-latzi-visit
comedy,Victor,M,military_man_(war_veteran),military,,"Verzej-se uns, monsieur Meyer.",144,clemens-a-latzi-visit
comedy,Schakob,M,messenger/deliverer/helper,service_and_sales,lower_class,"Verzej-se uns, monsieur Meyer.",144,clemens-a-latzi-visit
comedy,Jean,M,valet,elementary_professions,lower_class,"Patron — verzeje se mr numme noch diss einte Mol — es soll mr e Warnung sinn, was ich hitt üsgstande hab. Ich due sicher hitt nix meh anstelle.",145,clemens-a-latzi-visit
comedy,Otto Mobil,M,manufacturer,industry_and_transportation,upper_class,"Na, Herr Meyer, seien Sie nich so hart wie ne Salamiwurst — Sie wissen ja: ""Jugend kennt keine Tugend"".",145,clemens-a-latzi-visit
comedy,J. Meyer,M,insurance_inspector,intermediate_professionals,upper_middle_class,"Mintswäje, will ich hitt noch so Chance hab, ze will ich noch emol beidi Aue züdruecke un will's Ejch durich lonn gehn.",146,clemens-a-latzi-visit
comedy,Jean,M,valet,elementary_professions,lower_class,"Vielmols merci, Patron. — Dr nej Generalagent soll läwe: vive, vive, vive!",146,clemens-a-latzi-visit
