drama_type,speaker,sex,job,job_category,social_class,text,progress,short_name
comedy,Hans,M,large_farmer,agriculture,upper_middle_class,"Herrgott was isch diss nit. Biz zuem Kinderhüete hawi's gebrocht — wenn diss der François sehne dät. Casper ! Zaj, Casper, nemm düs d'r wiel un sing-em ebbs wenn's brüehlt (ab).",74,bastian-dr-hans-im-schnokeloch
comedy,Casper,M,farm_worker,agriculture,lower_class,"Schloof, Urschele, schloof,|||Din Vadder hüet die Schoof,|||Din Muedder hüet die brüne Küehj;|||Kindel druck die Gickele züej.|||D'r Hans im Schnokeloch hett alles was er will|||Un wass'r will, diss hett'r nitt,|||Schloof, Urschele, schloof !",74,bastian-dr-hans-im-schnokeloch
comedy,Lehn,F,,,,"Potz Mannslitt un ken End! Ich glaab, dü bringsch diss Kind um. Schottels doch nit so heidemässj.",74,bastian-dr-hans-im-schnokeloch
comedy,Casper,M,farm_worker,agriculture,lower_class,Es — es singt.,74,bastian-dr-hans-im-schnokeloch
comedy,Angenes,F,,,,"Herrje, was hett's denn ?",74,bastian-dr-hans-im-schnokeloch
comedy,Lehn,F,,,,"Kumm, min Trütschele, kumm",74,bastian-dr-hans-im-schnokeloch
comedy,Angenes,F,,,,"Loss, amend ghört's schangiert.",75,bastian-dr-hans-im-schnokeloch
comedy,Urschel,F,,,,Was hett's ?,75,bastian-dr-hans-im-schnokeloch
comedy,Casper,M,farm_worker,agriculture,lower_class,s'Will ebbs wisse.,75,bastian-dr-hans-im-schnokeloch
comedy,Urschel,F,,,,"Kumm, min Hämmele. Wie diss Kind e verschangierti Stimm hett zitt'r dass-es gedaift isch.",75,bastian-dr-hans-im-schnokeloch
comedy,Angenes,F,,,,"Jo, allewäj.",75,bastian-dr-hans-im-schnokeloch
comedy,Hans,M,large_farmer,agriculture,upper_middle_class,"Casper, nit emol e Kind kannsch hüete. Hesch-em denn nit gsunge ?",75,bastian-dr-hans-im-schnokeloch
comedy,Casper,M,farm_worker,agriculture,lower_class,"Jo, hawi — es hett awer wittersch gsunge",75,bastian-dr-hans-im-schnokeloch
comedy,Urschel,F,,,,"Hett's Bicheleweh, s'Bubbele, ei, ei.|||Majeräje mach mi gross,|||Ich bin e klaane Stumbe|||Sunsch kummi unter d'Lumbe.",75,bastian-dr-hans-im-schnokeloch
comedy,Hans,M,large_farmer,agriculture,upper_middle_class,"Spack's do nyn. Mer derf die Krüpel nit so verwöhne. Allehopp, d'r Nuller in's Müül un nim gerajt, sunscht rauch'ts in d'r Fechtschuel|||So, un still jetzt, was maansch denn, dü Krott ?",75,bastian-dr-hans-im-schnokeloch
comedy,Angenes,F,,,,"Hans, sej doch nit so wüeschterlich mit dinere Doochter.",75,bastian-dr-hans-im-schnokeloch
comedy,Urschel,F,,,,So hett'rs allewiel. Er isch au emol e Bitschelbubbel gsin|||.,75,bastian-dr-hans-im-schnokeloch
comedy,Angenes,F,,,,"s'Isch schun gar lang here, gell Goldhansel.",75,bastian-dr-hans-im-schnokeloch
comedy,Hans,M,large_farmer,agriculture,upper_middle_class,"Jo geh, geh, dass ich Nieme meh sieh.",76,bastian-dr-hans-im-schnokeloch
comedy,Angenes,F,,,,"Gieb mer jo recht Acht uff's Kind, schaich-em d'Mucke un d'Schnoke|||.",76,bastian-dr-hans-im-schnokeloch
comedy,Hans,M,large_farmer,agriculture,upper_middle_class,"Wenn numme d'Kinder glich laufe däfe, wenn se uff d'Welt kumme. Zaj, Casper, kumm here, waauel dü. Casper !",76,bastian-dr-hans-im-schnokeloch
comedy,Gerôme,M,veterinary,professionals_scientific_technical,upper_middle_class,"A, do stecksch Hans, was hesch de denn ?",76,bastian-dr-hans-im-schnokeloch
comedy,Hans,M,large_farmer,agriculture,upper_middle_class,"E Maidel hawi — wenn ich numme noch leddi wär, odder wenn ich d'Sybille ghirot hätt, hält ich jetzt e Bue.",76,bastian-dr-hans-im-schnokeloch
comedy,Gerôme,M,veterinary,professionals_scientific_technical,upper_middle_class,Awer din ney Hüss gfallt maneidi guet.,76,bastian-dr-hans-im-schnokeloch
comedy,Hans,M,large_farmer,agriculture,upper_middle_class,"Mir nit, s'isch mer ze windig, nit comod genue, ze vierecket. s'Röjt mich, dass ich's böüje hab lonn, soviel ich Hoor uff-em Kopf hab. Sieht Er, Gerôme, e Johr ghirot un do hett mer's Unglück",76,bastian-dr-hans-im-schnokeloch
comedy,Gerôme,M,veterinary,professionals_scientific_technical,upper_middle_class,Dü bisch au mit nix zefridde.,76,bastian-dr-hans-im-schnokeloch
comedy,Casper,M,farm_worker,agriculture,lower_class,Genue vun dere Sort,76,bastian-dr-hans-im-schnokeloch
comedy,Gerôme,M,veterinary,professionals_scientific_technical,upper_middle_class,"Herrgott, isch diss e trüürige Kinddaif. Diss Jungvolk hett gar ken Marik meh in de Knoche|||Erüss un d'r Schunke gedräjt. Müsik, for was isch denn die do ?",76,bastian-dr-hans-im-schnokeloch
comedy,Hans,M,large_farmer,agriculture,upper_middle_class,"Ken Müsik, s'Kind hett Büchweh. He, Urschel ! Urschel !",76,bastian-dr-hans-im-schnokeloch
comedy,Urschel,F,,,,"Herrje, miner Mogge grient. Ja, d'Mame nemmt dich. O, kumm dü klaani Büchere|||ab).",76,bastian-dr-hans-im-schnokeloch
comedy,Gerôme,M,veterinary,professionals_scientific_technical,upper_middle_class,"Alle, Hans, mach dass Lewe in boite kummt. Müsikante, e gfizt's Wälzerle, e waich's wo lüpft, hoppla.",77,bastian-dr-hans-im-schnokeloch
comedy,Hans,M,large_farmer,agriculture,upper_middle_class,Die Müsik kann mer gschtohle wäre.,77,bastian-dr-hans-im-schnokeloch
comedy,Gerôme,M,veterinary,professionals_scientific_technical,upper_middle_class,"Alle, alle, ihr Maidle un Burscht, d'Ferschte gelüpft.",77,bastian-dr-hans-im-schnokeloch
comedy,Urschel,F,,,,"Hans, helf, Hans ! — Hans!",77,bastian-dr-hans-im-schnokeloch
comedy,Hans,M,large_farmer,agriculture,upper_middle_class,Ursch !,77,bastian-dr-hans-im-schnokeloch
comedy,Urschel,F,,,,"Helf, s'Kind, s'Kind, helf!",77,bastian-dr-hans-im-schnokeloch
comedy,Hans,M,large_farmer,agriculture,upper_middle_class,"Wo helf, wie ?",77,bastian-dr-hans-im-schnokeloch
comedy,Angenes,F,,,,"Mössjö Gerôme, kumme|||ich bitt 'ne.",77,bastian-dr-hans-im-schnokeloch
comedy,Gerôme,M,veterinary,professionals_scientific_technical,upper_middle_class,Was isch denn gschehne ?,77,bastian-dr-hans-im-schnokeloch
comedy,Lehn,F,,,,So ebbs isch noch nit bassiert.,77,bastian-dr-hans-im-schnokeloch
comedy,Angenes,F,,,,"Mon Dieu, bon Dieu !",77,bastian-dr-hans-im-schnokeloch
comedy,Hans,M,large_farmer,agriculture,upper_middle_class,"Urschel — zum Güxel, was isch ?",77,bastian-dr-hans-im-schnokeloch
comedy,Lehn,F,,,,s'Maidel isch e Bue worre.,78,bastian-dr-hans-im-schnokeloch
comedy,Hans,M,large_farmer,agriculture,upper_middle_class,"Was, e, e Bue — ewek ewek|||.",78,bastian-dr-hans-im-schnokeloch
comedy,Urschel,F,,,,E Bue,78,bastian-dr-hans-im-schnokeloch
comedy,Amelie,F,,,,Nit möjlich !,78,bastian-dr-hans-im-schnokeloch
comedy,Angenes,F,,,,"Liewer Babbe Gerôme, mach Er's widder guet.",78,bastian-dr-hans-im-schnokeloch
comedy,Gerôme,M,veterinary,professionals_scientific_technical,upper_middle_class,"Ja, ich bin doch ken Hexemeister. Fröüje doch d'Hewamm, die isch jo e compedenti Person.",78,bastian-dr-hans-im-schnokeloch
comedy,Löjel,M,taverner/innkeeper,service_and_sales,lower_middle_class,"O miner Büch, hewe mich — Luft — naan, eso e Gschbass — o miner Büch",78,bastian-dr-hans-im-schnokeloch
comedy,Hans,M,large_farmer,agriculture,upper_middle_class,"s'Isch e Bue, s'isch e Bue, Müsik, s'isch e Bue, diuhu !",78,bastian-dr-hans-im-schnokeloch
comedy,Lehn,F,,,,"Der Mensch isch e Narr, ken Müsik.",78,bastian-dr-hans-im-schnokeloch
comedy,Gerôme,M,veterinary,professionals_scientific_technical,upper_middle_class,"Warte, ich redd mit d'r Hewamm",78,bastian-dr-hans-im-schnokeloch
comedy,Hans,M,large_farmer,agriculture,upper_middle_class,"Un s'isch doch e Bue un wenn'rs jetzt döisigmol nit wölle hann. Ich hab gewunne, d'Babbesitt isch doch Maischter worre. Was koscht s'Münster! — Hä, un ihr Zipfel, wo b'haupt hann, es glicht mir nit. Wie kann e Bue d'r Mame gliche, ihr — Urschel, wo isch mini Frau, miner Herzkäfer, Müsik|||D'r Hans im Schnokeloch|||Hett alles wass'r will,|||Er hett e Maidel, s'isch e Bue|||Und diss will haisse grad genue",78,bastian-dr-hans-im-schnokeloch
comedy,alle,U,,,,"D'r Hans im Schnokeloch|||Hett alles wass'r will,",78,bastian-dr-hans-im-schnokeloch
comedy,Gerôme,M,veterinary,professionals_scientific_technical,upper_middle_class,"Haltela, haltela, d'Hewamm saat, diss wär ihr siewezigst Maidel, wo sie üewer Dauf hebt. Si könnts bschwöre, dass-es e Maidel isch gsin, un wenn's ebbs andersch isch worre, no wär e Meerwunder gschehne.",79,bastian-dr-hans-im-schnokeloch
comedy,Löjel,M,taverner/innkeeper,service_and_sales,lower_middle_class,"Haha! — Ich geh noch üss-em Liem, haha !",79,bastian-dr-hans-im-schnokeloch
comedy,Hans,M,large_farmer,agriculture,upper_middle_class,"Wäje mir isch's was will, d'Hauptsach bliebt, s'isch e Bue, un ihr sin alli blamiert. Wyn here, Gsottes un Gebrotes — ich hab e Bue",79,bastian-dr-hans-im-schnokeloch
comedy,Urschel,F,,,,Jesses — Jesses ! —,79,bastian-dr-hans-im-schnokeloch
comedy,Hans,M,large_farmer,agriculture,upper_middle_class,Was gitt's schun widder ?,79,bastian-dr-hans-im-schnokeloch
comedy,Lehn,F,,,,Isch diss e Trafari !,79,bastian-dr-hans-im-schnokeloch
comedy,Angenes,F,,,,d'Welt geht noch unter.,79,bastian-dr-hans-im-schnokeloch
comedy,Urschel,F,,,,Jetzt haisst jo d'r Bue Urschel !,79,bastian-dr-hans-im-schnokeloch
comedy,Löjel,M,taverner/innkeeper,service_and_sales,lower_middle_class,"O je — helfe mer, haha — d'r Bue haisst — oweh !",79,bastian-dr-hans-im-schnokeloch
comedy,Hans,M,large_farmer,agriculture,upper_middle_class,"C'est égal, e Wecke odder e Brettstell. Worum derf e Bue nit emol Urschel haisse ?",79,bastian-dr-hans-im-schnokeloch
comedy,Gerôme,M,veterinary,professionals_scientific_technical,upper_middle_class,"So isch erecht, Hans — bravo ! Jetzt wurd's doch, aanmol lusti wäre.",79,bastian-dr-hans-im-schnokeloch
comedy,Hans,M,large_farmer,agriculture,upper_middle_class,Wyn here !,79,bastian-dr-hans-im-schnokeloch
comedy,Gerôme,M,veterinary,professionals_scientific_technical,upper_middle_class,Singe mer aans ?,80,bastian-dr-hans-im-schnokeloch
comedy,Löjel,M,taverner/innkeeper,service_and_sales,lower_middle_class,"Diss loss ich mer gfalle. Urschel schenk yn, Hans, dupf an !",80,bastian-dr-hans-im-schnokeloch
comedy,Urschel,F,,,,"Hans, ich bin schreckli unglücklich.",80,bastian-dr-hans-im-schnokeloch
comedy,Hans,M,large_farmer,agriculture,upper_middle_class,"Ich nit, ich möcht for Fraid s'Rädel schlaaue, ewek mache mer Platz",80,bastian-dr-hans-im-schnokeloch
comedy,Lehn,F,,,,Dem isch e Schrüb los gange. Hans !,80,bastian-dr-hans-im-schnokeloch
comedy,Hans,M,large_farmer,agriculture,upper_middle_class,"Gerôme, jetzt kummt Lewe in's Bluet. D'r Vadderstolz macht mer s'Herz jübiliere. Ursch, kumm, Gsundheit.",80,bastian-dr-hans-im-schnokeloch
comedy,alle,U,,,,Gsundheit.),80,bastian-dr-hans-im-schnokeloch
comedy,Lehn,F,,,,Werum winkt denn d'r Casper mit-em Bese ?,80,bastian-dr-hans-im-schnokeloch
comedy,Gerôme,M,veterinary,professionals_scientific_technical,upper_middle_class,"Casper, was gitt's do hinte ?",80,bastian-dr-hans-im-schnokeloch
comedy,Casper,M,farm_worker,agriculture,lower_class,"Sie kumme, sie kumme !",80,bastian-dr-hans-im-schnokeloch
comedy,Urschel,F,,,,Isch diss nit d'Madame Hasefratz ?,80,bastian-dr-hans-im-schnokeloch
comedy,Angenes,F,,,,d'Sybille ?,80,bastian-dr-hans-im-schnokeloch
comedy,Lehn,F,,,,"Lüeje, wie sie rennt.",81,bastian-dr-hans-im-schnokeloch
comedy,Urschel,F,,,,Un s'Bärwel hintenoch mit-em Kind.,81,bastian-dr-hans-im-schnokeloch
comedy,Löjel,M,taverner/innkeeper,service_and_sales,lower_middle_class,Was isch denn jetz widder los ?,81,bastian-dr-hans-im-schnokeloch
comedy,Sybille,F,,,,"O, mon Dieu — Essj — lonn mich sitze.",81,bastian-dr-hans-im-schnokeloch
comedy,Bärwel,F,,,,"A — püh ! — Durst, Wyn|||sich). Isch diss e Jagd!",81,bastian-dr-hans-im-schnokeloch
comedy,Lehn,F,,,,"Was hett Si denn, Hasefratzere ?",81,bastian-dr-hans-im-schnokeloch
comedy,Sybille,F,,,,Nous sommes malheureux !,81,bastian-dr-hans-im-schnokeloch
comedy,Angenes,F,,,,Waje werum ?,81,bastian-dr-hans-im-schnokeloch
comedy,Bärwel,F,,,,"E, ihr Bue isch e Maide wurre, dass'rs wisse.",81,bastian-dr-hans-im-schnokeloch
comedy,Urschel,F,,,,Was?,81,bastian-dr-hans-im-schnokeloch
comedy,Hans,M,large_farmer,agriculture,upper_middle_class,"Wie hesch gsaat, Bärwel ?",81,bastian-dr-hans-im-schnokeloch
comedy,Löjel,M,taverner/innkeeper,service_and_sales,lower_middle_class,"Ich halt's nimm üss, haha !",81,bastian-dr-hans-im-schnokeloch
comedy,Frau Amos,F,midwife,professionals_scientific_technical,lower_class,"Höre, sisch e Bue un bliebt e Bue, er duet's nit andersch. Arrangez-vous, isch e wälschi Hochzitt, un e Mirakel isch e Mirakel",82,bastian-dr-hans-im-schnokeloch
comedy,Sybille,F,,,,E Bue hann ihr ? Diss isch sicher miner Bue.,82,bastian-dr-hans-im-schnokeloch
comedy,Hans,M,large_farmer,agriculture,upper_middle_class,"Oho ! — halt an Schangele, do wurd nix drüss !",82,bastian-dr-hans-im-schnokeloch
comedy,Urschel,F,,,,"Hans, mer hann doch e Maidel ghett.",82,bastian-dr-hans-im-schnokeloch
comedy,Hans,M,large_farmer,agriculture,upper_middle_class,Diss gitt mich alles nix an.,82,bastian-dr-hans-im-schnokeloch
comedy,Urschel,F,,,,"Diss isch min Urschele, genn mers genn's",82,bastian-dr-hans-im-schnokeloch
comedy,Sybille,F,,,,"z'Erscht miner Bue here. Bärwel, nix do",82,bastian-dr-hans-im-schnokeloch
comedy,Hans,M,large_farmer,agriculture,upper_middle_class,"Ich protestier d'rgeje, ich lied's nit, ich protestier nochemol.",82,bastian-dr-hans-im-schnokeloch
comedy,Urschel,F,,,,"Hans, ich will denne Bue hole.",82,bastian-dr-hans-im-schnokeloch
comedy,Hans,M,large_farmer,agriculture,upper_middle_class,"Nix do|||Ewek saa ich. Wer mer üewer d'Schwell geht, der kann saaue er hett d'r letscht Schnabber gemacht. Der Bue isch min Fleisch un Bluet. Ich gieb 'ne nit erüss un wenn d'r Daifel uff de Stelze kummt.",82,bastian-dr-hans-im-schnokeloch
comedy,Sybille,F,,,,"Genn mer miner Bue, ich bitt Euch uff de Knej, genn mer 'ne.",82,bastian-dr-hans-im-schnokeloch
comedy,Gerôme,M,veterinary,professionals_scientific_technical,upper_middle_class,"Lache müesst ich, wenn der Bue üewerhaupt in alle zwaj nit ghöre dät.",82,bastian-dr-hans-im-schnokeloch
comedy,Löjel,M,taverner/innkeeper,service_and_sales,lower_middle_class,"Au möjlich. Mer hett's nit lycht, for Grossvadder ze wäre.",83,bastian-dr-hans-im-schnokeloch
comedy,Urschel,F,,,,"Hans, sej doch verständi, witt denn dü e Kind uffzejhe, wo dich nix angeht ?",83,bastian-dr-hans-im-schnokeloch
comedy,Lehn,F,,,,"Denne fremde Bue erüss, saa ich. Hans, bisch de denn maschuke ?",83,bastian-dr-hans-im-schnokeloch
comedy,Angenes,F,,,,"Madam Hasefratz, isch's denn möjlich, wo hann'r denn die Kinder verdüscht.",83,bastian-dr-hans-im-schnokeloch
comedy,Sybille,F,,,,"Möjlich ? — Ei sin sie denn nit for d'r Kirich bie uns d'haam gsin un sin nit d'Kinder newenander uff's Bett gelajt worre ? — un derno will noch s'Unglück dass mer d'r nemlich Draasak hann, als wie ihr.",83,bastian-dr-hans-im-schnokeloch
comedy,Frau Nessnass,F,,,,"E jo, ken Zwiefel, so isch's.",83,bastian-dr-hans-im-schnokeloch
comedy,Sybille,F,,,,"In unsere Kirich sin vier Kinddaife uff aanmol gsin un miner Mann hett gedenkt, es könnt viellicht dort e changement genn hann un jetzt isch'r uff d'Suech gange zue denne Litt. Genn mer miner Bue.",83,bastian-dr-hans-im-schnokeloch
comedy,Hans,M,large_farmer,agriculture,upper_middle_class,"Alles isch hin, d'Fraid isch furt, o ich unglücklicher Hans",83,bastian-dr-hans-im-schnokeloch
comedy,Urschel,F,,,,Gott sej Dank !,83,bastian-dr-hans-im-schnokeloch
comedy,Gerôme,M,veterinary,professionals_scientific_technical,upper_middle_class,Isch mer diss e Kinddaifschmüss.,83,bastian-dr-hans-im-schnokeloch
comedy,Hans,M,large_farmer,agriculture,upper_middle_class,"Aerjer statt Fraid im Hüüs, alles im letzte Glaich, ach!",83,bastian-dr-hans-im-schnokeloch
comedy,alle,U,,,,"Isch mer diss e Kinddaifschmüüs !|||Aerjer, statt Fraid im Hüüs !|||Alles im letze Glaich ;|||Isch diss e Streich !|||Hab mich schun lang druff gfrait|||Hab kein Unköschte gscheut|||Un doch fast ganz mankiert|||O diss vexiert !|||Drum, ihr liewe Litt, soll's Hüüs|||Hell sin bie'm Kinddaifschmüüs,|||O so vergesse nit,|||Ebbs bringe mit:|||d'Singlust, dass 's helluff klingt|||Bis mer am End gar singt:",83,bastian-dr-hans-im-schnokeloch
comedy,Urschel,F,,,,Do nemmt Si Gottsname ihre Bue.,84,bastian-dr-hans-im-schnokeloch
comedy,Hans,M,large_farmer,agriculture,upper_middle_class,"Ach, ich, ich kann's nit verschmerze.",84,bastian-dr-hans-im-schnokeloch
comedy,Sybille,F,,,,Do hett Si ihr Maidel.,84,bastian-dr-hans-im-schnokeloch
comedy,Urschel,F,,,,"Ja, s'isch min Urschele, unser Kind",84,bastian-dr-hans-im-schnokeloch
comedy,Hans,M,large_farmer,agriculture,upper_middle_class,Jetzt hawi doch e Maidel. Wenn ich numme in Amerika wär.,84,bastian-dr-hans-im-schnokeloch
comedy,Sybille,F,,,,"Ja, s'isch'r, miner Goldbue, ich kenn 'ne an de Ohre|||Bärwel, do nemm 'ne denne Spitzbue.",84,bastian-dr-hans-im-schnokeloch
comedy,Gerôme,M,veterinary,professionals_scientific_technical,upper_middle_class,"Gott sej's uff de Knej gedankt, die Sach wär im Glaich.",84,bastian-dr-hans-im-schnokeloch
comedy,Sybille,F,,,,Was wurd min Mann saaue. Der suecht alli Kinddaife uff.,84,bastian-dr-hans-im-schnokeloch
comedy,Hans,M,large_farmer,agriculture,upper_middle_class,"Ja, hört Si, Madam Hasefratz, wie haisst denn au ihre Bue ?",84,bastian-dr-hans-im-schnokeloch
comedy,Sybille,F,,,,"Quelle qustion, Artür, wie miner Mann.",84,bastian-dr-hans-im-schnokeloch
comedy,Hans,M,large_farmer,agriculture,upper_middle_class,"Fehlgschosse, haha ! Urschel haisst'r.",84,bastian-dr-hans-im-schnokeloch
comedy,Sybille,F,,,,Dü Allmächtjer helf ! — Urschel ?,84,bastian-dr-hans-im-schnokeloch
comedy,Urschel,F,,,,"Un unser Maidel haisst Artür, Jesses, Jesses !",85,bastian-dr-hans-im-schnokeloch
comedy,Hans,M,large_farmer,agriculture,upper_middle_class,"Jetzt wurd's lusti, haha,",85,bastian-dr-hans-im-schnokeloch
comedy,Löjel,M,taverner/innkeeper,service_and_sales,lower_middle_class,"Ich kann nimmi, hewe mich",85,bastian-dr-hans-im-schnokeloch
comedy,Sybille,F,,,,"O ihr guete Mensche, helfe — helfe",85,bastian-dr-hans-im-schnokeloch
comedy,Gerôme,M,veterinary,professionals_scientific_technical,upper_middle_class,Was gitt's denn schun widder ?,85,bastian-dr-hans-im-schnokeloch
comedy,Urschel,F,,,,D'Kinder sin letz gedaift ! — Hans!,85,bastian-dr-hans-im-schnokeloch
comedy,Löjel,M,taverner/innkeeper,service_and_sales,lower_middle_class,Vier Ohnmachte uff aan Zuck. Essj !,85,bastian-dr-hans-im-schnokeloch
comedy,Gerôme,M,veterinary,professionals_scientific_technical,upper_middle_class,"Diss Gschäft geht en gros|||— Da, do lejt jo d'r Löjel un strampelt. Löjel, bisch denn gebikt ? Hewe-ne doch in d'Höh. Do Männel, nemm e Nas voll.",85,bastian-dr-hans-im-schnokeloch
comedy,Urschel,F,,,,"Babbe, was hesch ?",85,bastian-dr-hans-im-schnokeloch
comedy,Löjel,M,taverner/innkeeper,service_and_sales,lower_middle_class,"Horche — miner Büch hett e Sprung, oje.",85,bastian-dr-hans-im-schnokeloch
comedy,Gerôme,M,veterinary,professionals_scientific_technical,upper_middle_class,"Kinder, seje doch aanmol e bissel räsonawel. Isch diss au e plaisir anere so e Kinddaif ? Was die letz Daiferei anbelangt, ze tröste euch. Die Sach kann morje früehj durch d'r Pfarrer arrangiert wäre.",85,bastian-dr-hans-im-schnokeloch
comedy,Hans,M,large_farmer,agriculture,upper_middle_class,"Ei, der Babbe Löjel isch jo e Wiederdaifer, der könnt's jo glich mache.",85,bastian-dr-hans-im-schnokeloch
comedy,Angenes,F,,,,"Oh, min Kopf, oh, min Kopf !",86,bastian-dr-hans-im-schnokeloch
comedy,Gerôme,M,veterinary,professionals_scientific_technical,upper_middle_class,"Silence. Ich glaab mer könnte emol nooch dem Schrecke uff d'Gsundheit vun denne junge Bürjerskinder trinke. Un dü, Hans, henk mer d'r Lippel nit. Maidel hin, Maidel her. Uff's nächscht Johr muess d'r Storik e Hansel bstelle. Wo isch denn d'Müsik, he Casper !|||Ihr Litt, jetzt müehn mer singe,|||Es geht ze riewi her,|||Frau Baas i will's 're bringe,|||Un imm au Herr Gumbär ;|||Die Wiewer solle lewe !|||Die Männer au derzue !|||Johr üss, Johr yn soll's gewe|||E Maidel odder e Bue,|||Hallo, hallo, hallo, hallo !|||Es g'fallt ess halt e so.",86,bastian-dr-hans-im-schnokeloch
comedy,Gerôme,M,veterinary,professionals_scientific_technical,upper_middle_class,"Der Pfarrer kann jo daufe|||Im Kirche-Rock un Krees,|||Un Kinddaufwecke kaufe|||Macht kenne Mensche bös !|||Es kann nix netters gewe,|||Als kleini Wäckerle ;|||Frau Nochbre-n-es soll lewe Im Korb der Hänsele !|||Hallo, hallo, hallo, hallo !|||Es isch gar nett e so.",86,bastian-dr-hans-im-schnokeloch
comedy,Löjel,M,taverner/innkeeper,service_and_sales,lower_middle_class,"So isch erecht !|||Ich bin lusti, ich muess singe|||Stejt der Wyn mer in de Kopf;|||Keiner sej, wenn d'Gläser klinge,|||Munkedrissel, finstrer Tropf.|||E la Gumbanie soll lewe !|||Vetter, Baas ! i gib mer d'Ehr ;|||s'Isch ebbs netts um unsri Rewe,|||Druff trink ich min Gläsel leer.",86,bastian-dr-hans-im-schnokeloch
comedy,Gerôme,M,veterinary,professionals_scientific_technical,upper_middle_class,"Gsundheit ! Hans, alle, dü kannsch denne Vers so guet vun denne Wynle.",86,bastian-dr-hans-im-schnokeloch
comedy,Hans,M,large_farmer,agriculture,upper_middle_class,"Hellejesteiner, Muschkedelle,|||Wolxemer un Kidderle,|||Richewirer, Berker, Zeller,|||Lütter guedi Winele !|||Kummt d'r Herbst, gibts doch manch Ständel,|||Wer pariert mit mer ? i wett.|||Vivat s'Elsass, unser Ländel Diss so gueti Winle hett !",86,bastian-dr-hans-im-schnokeloch
comedy,alle,U,,,,Vivat s'Elsass etc.),86,bastian-dr-hans-im-schnokeloch
comedy,Casper,M,farm_worker,agriculture,lower_class,"Er kummt, er kummt !",86,bastian-dr-hans-im-schnokeloch
comedy,Hans,M,large_farmer,agriculture,upper_middle_class,Wer kummt ?,86,bastian-dr-hans-im-schnokeloch
comedy,Gerôme,M,veterinary,professionals_scientific_technical,upper_middle_class,Isch denn schun widder e Unglück bassiert ?,86,bastian-dr-hans-im-schnokeloch
comedy,Hans,M,large_farmer,agriculture,upper_middle_class,Was isch denn diss for e Vöjel ?,86,bastian-dr-hans-im-schnokeloch
comedy,Sybille,F,,,,"Jerum, Artür, bisch's — odder bisch's nit ?",86,bastian-dr-hans-im-schnokeloch
comedy,Hasenfratz,M,,,,"Ja, ich — ich — bin's. Awer — numme — noch halwer",87,bastian-dr-hans-im-schnokeloch
comedy,Löjel,M,taverner/innkeeper,service_and_sales,lower_middle_class,Denne hann se nit üewel verkamisolt.,87,bastian-dr-hans-im-schnokeloch
comedy,Sybille,F,,,,"Artür, was isch gschehne, redd. Lüej do, do hawi 'ne, unsere Bue.",87,bastian-dr-hans-im-schnokeloch
comedy,Hasenfratz,M,,,,"Un ich hab d'Bumbes. Gott sej Dank, dass mer 'ne hann.",87,bastian-dr-hans-im-schnokeloch
comedy,Gerôme,M,veterinary,professionals_scientific_technical,upper_middle_class,"Montrez donc! — Oho, d'Nas uffgschirpft, s'Ohreläppel verschunde, e Zahn hüsse. Schnell Wasser un e Lintuech.",87,bastian-dr-hans-im-schnokeloch
comedy,Urschel,F,,,,Wie'r ussieht !,87,bastian-dr-hans-im-schnokeloch
comedy,Hasenfratz,M,,,,"Oweh, min Kryz.",87,bastian-dr-hans-im-schnokeloch
comedy,Sybille,F,,,,Wo bisch de denn so gfalle? Herrje un d'r Schibüs.,87,bastian-dr-hans-im-schnokeloch
comedy,Hasenfratz,M,,,,"Bie drej Kinddaife bin ich gsin un hab unsere Bue gsuecht. Bie d'r letschte hawi gsaat, diss isch'r, genn mer 'ne rüss, odder ich hol d'Gendarme. Was will Er, unsere Bue!? — Die ganz Kinddaifgsellschaft, zwanzig Personen starik, ohne d'r Hund, isch hinter mich her un als druff, rechts, links hett's geräjt mit Fuschtepaschtete, und d'Stäj naagflöüje isch im Handumdräje gschehn gsin.",87,bastian-dr-hans-im-schnokeloch
comedy,Hans,M,large_farmer,agriculture,upper_middle_class,Diss sin harti Zuckerbohne.,87,bastian-dr-hans-im-schnokeloch
comedy,Gerôme,M,veterinary,professionals_scientific_technical,upper_middle_class,"Mössjö Hasefratz, eryn in d'Stubb, dass ich-em d'Nas vorschueh un d'Ohrläpple frisch ynbendel",87,bastian-dr-hans-im-schnokeloch
comedy,Nessnass,M,master_cooper,crafts,lower_middle_class,"Naan, ich bin alt worre, awer eso e Daa hawi min Daa des Lewes noch nit erlebt.",87,bastian-dr-hans-im-schnokeloch
comedy,Frau Nessnass,F,,,,d'Welt isch verkehrt un d'Litt sin letz.,88,bastian-dr-hans-im-schnokeloch
comedy,Urschel,F,,,,Hans bisch ze fridde jetzt ?,88,bastian-dr-hans-im-schnokeloch
comedy,Hans,M,large_farmer,agriculture,upper_middle_class,"Zefridde!? Wenn ich hundert mol lusti will sin, s'geht nit. Ich kanns nit verschmerze, dass ich doch e Maidel muess hann, wo aunoch Artür haisst, protestantisch gedaift isch. O Welt!",88,bastian-dr-hans-im-schnokeloch
comedy,Bärwel,F,,,,"Ja, so isch's, wenn mer Babbe wurd.",88,bastian-dr-hans-im-schnokeloch
comedy,Löjel,M,taverner/innkeeper,service_and_sales,lower_middle_class,"D'r Hans muess-ess wisse :|||Liewer Gott, wie wurd's eim so warm|||Hett mer e Maidel uff-em Arm !|||Isch's noch klein, möcht mer schun errote|||Ob's au wurd gerote ?|||Het's Glück im Hirote ?|||Fufzeh Johr get diss Fröüje furt.",88,bastian-dr-hans-im-schnokeloch
comedy,alle,U,,,,"So isch's, wenn mer Babbe wurd.",88,bastian-dr-hans-im-schnokeloch
comedy,Gerôme,M,veterinary,professionals_scientific_technical,upper_middle_class,Ich denk mit Gottes Hilf —,88,bastian-dr-hans-im-schnokeloch
comedy,Gerôme,M,veterinary,professionals_scientific_technical,upper_middle_class,"Was lache n'r ? — mit Gottes Hilf, wurd d'r Daa folls erumgehn un jetzt Müsikante gilt's e Ehredänzel for unser alt Hochzittspärel.",88,bastian-dr-hans-im-schnokeloch
comedy,Nessnass,M,master_cooper,crafts,lower_middle_class,"Alle, alle Gerôme, mache ken Saches, ich kann nit.",88,bastian-dr-hans-im-schnokeloch
