drama_type,speaker,sex,job,job_category,social_class,text,progress,short_name
comedy,Hans,M,large_farmer,agriculture,upper_middle_class,"Wass ! — diss isch jo e Mondkalb, so e Hornvieh.|||So e Schand, so e Schand. Adie Exposition. Die Kueh hett mich im ganze Elsass blamiert, ach ! eso e Schand. Wenn's numme ken Küeh gäbt,|||Alles hett sich geje mich verschwore, was bin ich e gschlaauener Mensch|||So e Schand — so e —|||Urschel ! — Urschel !|||Urschel, wenn Alles geje mich isch, gell dü nit ?",60,bastian-dr-hans-im-schnokeloch
comedy,Urschel,F,,,,"Hans, min Hans !|||. Nur dich will ich, und wenn hundert sapeurs kumme.",60,bastian-dr-hans-im-schnokeloch
comedy,Lehn,F,,,,"Bravo, Hans, bravo !",60,bastian-dr-hans-im-schnokeloch
comedy,Hans,M,large_farmer,agriculture,upper_middle_class,"Jetzt wurd e nejs Hüss geböüje, Urschel ! —",60,bastian-dr-hans-im-schnokeloch
comedy,Gerôme,M,veterinary,professionals_scientific_technical,upper_middle_class,"Hans, ich gieb d'r döüsig Liver for din Kalb.",60,bastian-dr-hans-im-schnokeloch
comedy,Hans,M,large_farmer,agriculture,upper_middle_class,"Was fröüj ich nooch-em Kalb, wenn's Urschel mine isch",60,bastian-dr-hans-im-schnokeloch
comedy,Angenes,F,,,,Jetzt hett'r doch die Bisszang.,61,bastian-dr-hans-im-schnokeloch
comedy,Lehn,F,,,,"Bravo, bravo !",61,bastian-dr-hans-im-schnokeloch
comedy,Urschel,F,,,,Die bliewe awer lang mit dem Kind.,61,bastian-dr-hans-im-schnokeloch
comedy,Lehn,F,,,,"Jo, die daife diss Kind zwajmol un fycht'es unterwäjs noch e paar mol aan.",61,bastian-dr-hans-im-schnokeloch
comedy,Urschel,F,,,,Wo si numme sin ?,61,bastian-dr-hans-im-schnokeloch
comedy,Lehn,F,,,,"Casper! — Angenes, Urschel, firschi, gedummelt.",61,bastian-dr-hans-im-schnokeloch
comedy,Angenes,F,,,,"Jo, ich renn mer noch d'Herzkammer yn. s'Isch ze viel an aim Daa — d'oldig Hochzitt vun unserem Brueder Nessnass hitt Morje — un z'Midaa's Kinddaif — un derno sin die zwaj alti Litt noch Pfedder un Göddel !",61,bastian-dr-hans-im-schnokeloch
comedy,Urschel,F,,,,Mer muess au an de Wyn denke for die Kiefer.,61,bastian-dr-hans-im-schnokeloch
comedy,Lehn,F,,,,"Ja, — saperlot, die kumme jo au, for unserem Brueder, im Nessnass, ihrem Zunftmaischter, e surprise ze mache. Firschi, Angenes — Casper!",61,bastian-dr-hans-im-schnokeloch
comedy,Angenes,F,,,,"Herrejeses — un d'r Stauffert mit sim Gänselspiel, der losst sich's nit nemme for ynzekehre. O|||Gott, ich waiss nit wo mer d'r Kopf steht",61,bastian-dr-hans-im-schnokeloch
comedy,Urschel,F,,,,"O Gott, was ich diss nit.",61,bastian-dr-hans-im-schnokeloch
comedy,Lehn,F,,,,Was hesch ze sifze ? — dass d'Sybille e Bue hett un ihr e Maidel ?,61,bastian-dr-hans-im-schnokeloch
comedy,Urschel,F,,,,"Ich derf nit dran denke. D'r Hans, wo so uff e Bue g'hofft hett.",62,bastian-dr-hans-im-schnokeloch
comedy,Lehn,F,,,,"Un mir druckt diss Hüss noch s'Herz ab|||— do steht's — ach — wenn ich's betracht lauft mer d'Gall üewer. So s'Geld schallbärewies zu verbambeschiere bie denne vertrakte Zitte, Aeker verkaufe -un verböüje.",62,bastian-dr-hans-im-schnokeloch
comedy,Urschel,F,,,,"So arj isch's doch nit, wie Si macht, Dante.",62,bastian-dr-hans-im-schnokeloch
comedy,Lehn,F,,,,"Dü — dü danz'sch grad nooch sinnere Lünepfiff, wenn ich sini Frau wär — Fahnebibbel un's Wetter, biem zwajte Wort muesst'r mer sechsfach zammeschnabbe wie e Zollstock !",62,bastian-dr-hans-im-schnokeloch
comedy,Urschel,F,,,,Armer Hans.,62,bastian-dr-hans-im-schnokeloch
comedy,Lehn,F,,,,"Jo, bedüür ''ne numme herzhaft.",62,bastian-dr-hans-im-schnokeloch
comedy,Urschel,F,,,,Diss gitt mer e netti Kinddaif. — Wo se numme so lang bliewe mit dem Bubbele? — Was riech ich denn ? —|||wie wenns — wenns ierjets gluntzle dät.,62,bastian-dr-hans-im-schnokeloch
comedy,Lehn,F,,,,"Jo, dü gluntzelsch au, Urschel — Casper, wo steckt denn|||jetzt loon mich umgkejt, ich glaab der fischt !? — Casper !",62,bastian-dr-hans-im-schnokeloch
comedy,Casper,M,farm_worker,agriculture,lower_class,Bscht ! — Bscht !|||s'bisst — bscht !,62,bastian-dr-hans-im-schnokeloch
comedy,Lehn,F,,,,Möcht mer do nit — wart ich biss d'r.,62,bastian-dr-hans-im-schnokeloch
comedy,Casper,M,farm_worker,agriculture,lower_class,Bscht! — es,62,bastian-dr-hans-im-schnokeloch
comedy,Gerôme,M,veterinary,professionals_scientific_technical,upper_middle_class,"Frau kaufe-n'r au Bese, Jo kumme-n-eryn, Hann'r schun z'Midaa gesse, Jo, schun e Wiel — Casper, ich glaab dü fangsch de n'Alte ?",62,bastian-dr-hans-im-schnokeloch
comedy,Lehn,F,,,,"Ob dü jetzt schaffsch, hä !",63,bastian-dr-hans-im-schnokeloch
comedy,Casper,M,farm_worker,agriculture,lower_class,D'r Kamerad muess ich au noch fange,63,bastian-dr-hans-im-schnokeloch
comedy,Lehn,F,,,,"Glich lajsch mer die Gert eweck, gfäjt, marsch !",63,bastian-dr-hans-im-schnokeloch
comedy,Gerôme,M,veterinary,professionals_scientific_technical,upper_middle_class,"Bonjour, bonjour. Wo stecke denn die Litt zamme ?",63,bastian-dr-hans-im-schnokeloch
comedy,Lehn,F,,,,Bonjour Gerôme.,63,bastian-dr-hans-im-schnokeloch
comedy,Gerôme,M,veterinary,professionals_scientific_technical,upper_middle_class,"Si excüsiert, ich komm direkt üewer Land, sunscht wär ich mit in d'Kirich. Wo sin se — mer hört un sieht nix.",63,bastian-dr-hans-im-schnokeloch
comedy,Lehn,F,,,,Entweder sin se in d'r Kirich odder im Wurtshüss.,63,bastian-dr-hans-im-schnokeloch
comedy,Urschel,F,,,,"Amend sin se biem Babbe ynkehrt, odder gar zue's Hasefratze e Visit mache. Die hann jo au Kinddaif hitt, d'Sybille, do wo's Bärwel Sajamm isch.",63,bastian-dr-hans-im-schnokeloch
comedy,Gerôme,M,veterinary,professionals_scientific_technical,upper_middle_class,"A — so — mhm ! Herrgott, diss gitt e Lewe hitt Jumpfer Madeleine. Goldigi Hochzitt, Kinddaif, do geht e gebrotener Ochs druff. He, Casper, wenn d'Kinddaif siehsch kumme vun wittem, winksch. Ich hab alli Säck mit Zuckerköjele gschbikt, dass Kneckes ebbs ze händle hann.",63,bastian-dr-hans-im-schnokeloch
comedy,Casper,M,farm_worker,agriculture,lower_class,Aehä !,63,bastian-dr-hans-im-schnokeloch
comedy,Urschel,F,,,,Kumme se ?,63,bastian-dr-hans-im-schnokeloch
comedy,Lehn,F,,,,"Dapfer, dapfer, Casper, spring Wyn hole.",63,bastian-dr-hans-im-schnokeloch
comedy,Gerôme,M,veterinary,professionals_scientific_technical,upper_middle_class,"Hitt wölle mer emol lusti sin. All Sorje müehn versaift wäre. Was Daifels, do kummt jo d'r Löjel ellaan.",64,bastian-dr-hans-im-schnokeloch
comedy,Löjel,M,taverner/innkeeper,service_and_sales,lower_middle_class,,64,bastian-dr-hans-im-schnokeloch
comedy,Urschel,F,,,,"Lüej d'r Babbe, bisch ellaan ? Wo sin denn d'andere ?",64,bastian-dr-hans-im-schnokeloch
comedy,Lehn,F,,,,Wo sin si ?,64,bastian-dr-hans-im-schnokeloch
comedy,Löjel,M,taverner/innkeeper,service_and_sales,lower_middle_class,"Buschur, buschur bisamme. — Sie kumme, ich bin üssgerisse un hab schnell noch Musikante zamme gedrummelt.",64,bastian-dr-hans-im-schnokeloch
comedy,Urschel,F,,,,"Gott, au noch Müsik. D'r Hans isch so schun unliedsem.",64,bastian-dr-hans-im-schnokeloch
comedy,Lehn,F,,,,"Wass, au noch Müsik. Na ja —",64,bastian-dr-hans-im-schnokeloch
comedy,Gerôme,M,veterinary,professionals_scientific_technical,upper_middle_class,Unliedsehm isch'r d'r Hans? — Wart Männel.,64,bastian-dr-hans-im-schnokeloch
comedy,Löjel,M,taverner/innkeeper,service_and_sales,lower_middle_class,A jo — er hett doch durchüss e Bue gewöllt. Er hett e Wuet — er kennt sich nimm.,64,bastian-dr-hans-im-schnokeloch
comedy,Gerôme,M,veterinary,professionals_scientific_technical,upper_middle_class,"He, ihr Burscht, wenn d'Kinddaif kummt, so spiele n'r d'r Murwaddel, bien compris, d'r Murwaddel vum Hartmann.",64,bastian-dr-hans-im-schnokeloch
comedy,Lehn,F,,,,"C'est-ça d'r Murwaddel, diss isch min Lieblingslied. Müsikante, setze euch do here.",64,bastian-dr-hans-im-schnokeloch
comedy,Gerôme,M,veterinary,professionals_scientific_technical,upper_middle_class,E-n-alter Murwaddel het z'lescht sich beklaaut.,64,bastian-dr-hans-im-schnokeloch
comedy,Lehn,F,,,,For was ?,65,bastian-dr-hans-im-schnokeloch
comedy,Gerôme,M,veterinary,professionals_scientific_technical,upper_middle_class,Im Nochbor sin Katz' het e bissel gemiaut.,65,bastian-dr-hans-im-schnokeloch
comedy,Löjel,M,taverner/innkeeper,service_and_sales,lower_middle_class,O Gschbass !,65,bastian-dr-hans-im-schnokeloch
comedy,Gerôme,M,veterinary,professionals_scientific_technical,upper_middle_class,"het gar im Nochber sin Hund au gebellt,|||Un d'Buewe-n-am Hüss uff de-n-Owe-n-im gschellt",65,bastian-dr-hans-im-schnokeloch
comedy,alle,U,,,,O Jerum ! O Jerum ! O Jeh ! Wie blitzt der Murwaddel in d'Höh !,65,bastian-dr-hans-im-schnokeloch
comedy,Lehn,F,,,,"s'Isch halt e zue schöns Lied. Ursch, geh dapfer Wyn hole for die Müsikante, sie hann doch allewiel e drucketi Lewer.",65,bastian-dr-hans-im-schnokeloch
comedy,Urschel,F,,,,Ja Dante,65,bastian-dr-hans-im-schnokeloch
comedy,Angenes,F,,,,"A, bonjour Mössjö Gerôme, lüej d'r grand'papa Löjel — wass, Müsikante ? — D'r Hans will Alles im Stille hann.",65,bastian-dr-hans-im-schnokeloch
comedy,Löjel,M,taverner/innkeeper,service_and_sales,lower_middle_class,Awer mir nit.,65,bastian-dr-hans-im-schnokeloch
comedy,Gerôme,M,veterinary,professionals_scientific_technical,upper_middle_class,"Bonjour, mademoiselle Agnès. Hu, wie Sie blüehjt, wie e Ros.",65,bastian-dr-hans-im-schnokeloch
comedy,Angenes,F,,,,"Hett Er au schun unser jung Glück gsehne ? — O, ich saa Ihm, e pracht's Kind. Elf Pfund hett's gewöüje, mon ami.",65,bastian-dr-hans-im-schnokeloch
comedy,Lehn,F,,,,"Jo, so saa doch glich zwanzig.",65,bastian-dr-hans-im-schnokeloch
comedy,Gerôme,M,veterinary,professionals_scientific_technical,upper_middle_class,Diss muess e gsunder Brocke sin.,66,bastian-dr-hans-im-schnokeloch
comedy,Angenes,F,,,,"s'Glicht im Babbe uff un nidder. Kumme se ball, Babbe Löjel ?",66,bastian-dr-hans-im-schnokeloch
comedy,Löjel,M,taverner/innkeeper,service_and_sales,lower_middle_class,Se wäre glich do sin.,66,bastian-dr-hans-im-schnokeloch
comedy,Angenes,F,,,,"Enfin, ich saa Ihm Mössjö Gerôme, e frappanterie Aehnlichkeit hett Er noch nit. erlebt.",66,bastian-dr-hans-im-schnokeloch
comedy,Löjel,M,taverner/innkeeper,service_and_sales,lower_middle_class,"Horche, e|||d'r Daifel, ich schmeck ebb's Verbrennt's — ebb's — rieche n'r nix ?",66,bastian-dr-hans-im-schnokeloch
comedy,Gerôme,M,veterinary,professionals_scientific_technical,upper_middle_class,D'r Kalbsqualle wurd brenzle.,66,bastian-dr-hans-im-schnokeloch
comedy,Lehn,F,,,,"Wass, miner Kalbsqualle — üss-em Wäj —|||ab).",66,bastian-dr-hans-im-schnokeloch
comedy,Angenes,F,,,,"Herrjeses —|||Wie üss-em Hans sim Gsicht gschnitte, oui.",66,bastian-dr-hans-im-schnokeloch
comedy,Urschel,F,,,,"So, ihr Müsikante. — Ihr Herre, Babbe, alle serviere euch.",66,bastian-dr-hans-im-schnokeloch
comedy,Angenes,F,,,,"Isch ebbs angebrennt Ursch? — Mössjö Gerôme, Er wurd stüne",66,bastian-dr-hans-im-schnokeloch
comedy,Urschel,F,,,,"Ihr excüsiere, ich muess drinne helfe (ab).",66,bastian-dr-hans-im-schnokeloch
comedy,Gerôme,M,veterinary,professionals_scientific_technical,upper_middle_class,"Jo, mer excüsiere. Alle, alter Löjel, setz dich chez moi. Na hett'r denn min Schwizbilwerle gholfe ?",66,bastian-dr-hans-im-schnokeloch
comedy,Löjel,M,taverner/innkeeper,service_and_sales,lower_middle_class,s'Wurd nit. Versoffe wärd ich ball im Bett.,67,bastian-dr-hans-im-schnokeloch
comedy,Gerôme,M,veterinary,professionals_scientific_technical,upper_middle_class,"Haha, so gschwizt hesch ? Was d'Ynbildung nit macht Dü Schöüde — es — diss Bilwerle isch nit meh gsin als Grumbeeremehl melangiert mit e bissel Zucker. Alle dupfe mer an.",67,bastian-dr-hans-im-schnokeloch
comedy,Löjel,M,taverner/innkeeper,service_and_sales,lower_middle_class,Nit möjlich !,67,bastian-dr-hans-im-schnokeloch
comedy,Gerôme,M,veterinary,professionals_scientific_technical,upper_middle_class,"Ich hab dir gsaat, wenn de dich nit in's Bett laijsch un dich nit ynmummelsch biz üewer d'Nas un nit zwaj Stunde so ohne ze müxe bliesch, no hesch de minsex d'r letzt Kalender an d'Wand g'henk. Un üss lütter Todesängste hesch de gschwizt.",67,bastian-dr-hans-im-schnokeloch
comedy,Löjel,M,taverner/innkeeper,service_and_sales,lower_middle_class,"Hör, alter Viehschinder, dü hesch hitt diner Frack uff d'r Sundaasitt zuegemacht.",67,bastian-dr-hans-im-schnokeloch
comedy,Gerôme,M,veterinary,professionals_scientific_technical,upper_middle_class,"Waisch, mer muess d'Litt nemme wie sie sin. Verschriebt mer nix, versteht mer nix, tu comprends. Dü kannsch d'r nit denke, was aim alles basiert. In-ere Frau saa ich s'letscht, ebb dass se ihrem Mann d'Medezin gitt, soll sie se herzhaft schittle, geht se anne un schittelt z'erscht denne kranke Tscholi, dass-em geel und grün wurd.",67,bastian-dr-hans-im-schnokeloch
comedy,Löjel,M,taverner/innkeeper,service_and_sales,lower_middle_class,"Haha, Giftje, sej still.",67,bastian-dr-hans-im-schnokeloch
comedy,Gerôme,M,veterinary,professionals_scientific_technical,upper_middle_class,"Ja, d'Mensche muess mer kenne un manchi lehre sich am wenigste selwer kenne. Do betracht d'r|||Hans, diner Doochtermann, diss isch so e Charakter un grad die werfe am allererschte d'r Löffel ewek, wenn 'ne emol im Lewe e n'Unglück basiert.",67,bastian-dr-hans-im-schnokeloch
comedy,Löjel,M,taverner/innkeeper,service_and_sales,lower_middle_class,"Oho, zell wär awer.",67,bastian-dr-hans-im-schnokeloch
comedy,Gerôme,M,veterinary,professionals_scientific_technical,upper_middle_class,"d'Wohrheit, j't'assure. Herrgott, wo ich in Baris stüdiert hab, was hab ich do erlebt un miner Vadder selj hett's viel Geld koscht — e paar Küeh sin druff gange. Un wie ich widder haam bin kumme hett'r zue mir gsaat, so ernscht : min Lebdesdöö hett ech's nit geglöbt, dass än Ochs e so viel Küehj koscht.",67,bastian-dr-hans-im-schnokeloch
comedy,Löjel,M,taverner/innkeeper,service_and_sales,lower_middle_class,"Din Vadder muess dich guet kennt hann, haha.",67,bastian-dr-hans-im-schnokeloch
comedy,Gerôme,M,veterinary,professionals_scientific_technical,upper_middle_class,"Ja, un ich saa, e mancher Dieb isch gscheider als d'r gschtüdiertscht Mediziner, ich b'haupt' s stracks, ja.",67,bastian-dr-hans-im-schnokeloch
comedy,Löjel,M,taverner/innkeeper,service_and_sales,lower_middle_class,"Geb, farceur.",68,bastian-dr-hans-im-schnokeloch
comedy,Gerôme,M,veterinary,professionals_scientific_technical,upper_middle_class,"Wenn e Dieb vun de Litt furtgeht, waiss'r uff d'r Dupfe was 'ne fehlt",68,bastian-dr-hans-im-schnokeloch
comedy,Löjel,M,taverner/innkeeper,service_and_sales,lower_middle_class,"Do hesch de Naauel uff d'r tête getroffe, Herrgott, bisse do aane d'Schnoke",68,bastian-dr-hans-im-schnokeloch
comedy,Casper,M,farm_worker,agriculture,lower_class,He!,68,bastian-dr-hans-im-schnokeloch
comedy,Gerôme,M,veterinary,professionals_scientific_technical,upper_middle_class,D'r Casper winkt. Sie kumme!|||Sie kumme !,68,bastian-dr-hans-im-schnokeloch
comedy,Urschel,F,,,,"Gott sej Dank|||Dante, sie kumme.",68,bastian-dr-hans-im-schnokeloch
comedy,Lehn,F,,,,Ei was ! — schun ?,68,bastian-dr-hans-im-schnokeloch
comedy,Angenes,F,,,,"Wo, wo ?",68,bastian-dr-hans-im-schnokeloch
comedy,Gerôme,M,veterinary,professionals_scientific_technical,upper_middle_class,"Müsik ! — d'r Murwaddel — un, deux, trois!",68,bastian-dr-hans-im-schnokeloch
comedy,Hans,M,large_farmer,agriculture,upper_middle_class,Au noch Müsik zuem Aerjer (wirft den Hut; auf die Bank).,68,bastian-dr-hans-im-schnokeloch
comedy,Lehn,F,,,,"Endlich! Ich glaab. ihr hann schun, wass'r brüche ?",68,bastian-dr-hans-im-schnokeloch
comedy,Stauffert,M,skipper,industry_and_transportation,lower_middle_class,Salü bisamme !,68,bastian-dr-hans-im-schnokeloch
comedy,Gerôme,M,veterinary,professionals_scientific_technical,upper_middle_class,"Do kummt d'Jügend un's Alter mitnander. So isch erecht, Hans, dräj d'r Lappe, hitt wölle mer s'gelte lonn. Nessnass, mer gratüliere zu d'r goldene Hochzitt un im junge Babbe uff sin jung Glück ! — Müsik ! „d'r Hans im Schnokeloch” etc.",69,bastian-dr-hans-im-schnokeloch
comedy,Urschel,F,,,,"So min Herzele, jetzt bisch dü au gedaift, gell’",69,bastian-dr-hans-im-schnokeloch
comedy,Lehn,F,,,,"Wo sin'r denn so lang gsteckt, ihr Trüdler ?",69,bastian-dr-hans-im-schnokeloch
comedy,Stauffert,M,skipper,industry_and_transportation,lower_middle_class,Vor der Kirch sin mer zue’s Hasefratze un hann aans gepäckelt.,69,bastian-dr-hans-im-schnokeloch
comedy,Urschel,F,,,,Was hawi nit gsaat.,69,bastian-dr-hans-im-schnokeloch
comedy,Hans,M,large_farmer,agriculture,upper_middle_class,"Ja un die müehn grad s’Gejeteil hann, was ich hab. Staufiert: Do betrachte emol denne Babbe, was'r for e Bonem schnied.",69,bastian-dr-hans-im-schnokeloch
comedy,Urschel,F,,,,Hans !,69,bastian-dr-hans-im-schnokeloch
comedy,Gerôme,M,veterinary,professionals_scientific_technical,upper_middle_class,"Kinder, genn Acht — s'kumme Kisselstaan|||So, als druff, uff d'Köpf, verhaue euch, da, als druff, haha!",69,bastian-dr-hans-im-schnokeloch
comedy,Hans,M,large_farmer,agriculture,upper_middle_class,Lonn mich gehn — ich bin unglücklich.,69,bastian-dr-hans-im-schnokeloch
comedy,Gerôme,M,veterinary,professionals_scientific_technical,upper_middle_class,"E, unglücklich, e Narr bisch, kumm her.",69,bastian-dr-hans-im-schnokeloch
comedy,Frau Nessnass,F,,,,Awer s'üssgschlupft Urschel.,69,bastian-dr-hans-im-schnokeloch
comedy,Angenes,F,,,,"O b'hüetes Gott naan. Lüeje doch diss Müüllele, diss Näsele, enfin, wie aagemolt, d'r Hans.",69,bastian-dr-hans-im-schnokeloch
comedy,Frau Nessnass,F,,,,"Betrachtes doch erecht, s'isch sini Mama. Genn mer's doch au e bissele.",70,bastian-dr-hans-im-schnokeloch
comedy,Hans,M,large_farmer,agriculture,upper_middle_class,Höre n'er's — ach ich verknell noch.,70,bastian-dr-hans-im-schnokeloch
comedy,Gerôme,M,veterinary,professionals_scientific_technical,upper_middle_class,"Jo, was vestehn d'Wiebslitt vun so Sache.",70,bastian-dr-hans-im-schnokeloch
comedy,Lehn,F,,,,Wie zwaj Tropfe Wasser.,70,bastian-dr-hans-im-schnokeloch
comedy,Hans,M,large_farmer,agriculture,upper_middle_class,Ich halt's nim üss|||.,70,bastian-dr-hans-im-schnokeloch
comedy,Gerôme,M,veterinary,professionals_scientific_technical,upper_middle_class,s'Isch doch e Bue ?,70,bastian-dr-hans-im-schnokeloch
comedy,Lehn,F,,,,Bhüetes naan.,70,bastian-dr-hans-im-schnokeloch
comedy,Gerôme,M,veterinary,professionals_scientific_technical,upper_middle_class,Wass — e Maidel — oh!,70,bastian-dr-hans-im-schnokeloch
comedy,Hans,M,large_farmer,agriculture,upper_middle_class,E Maidel! — ich möcht nim existiere — e Maidel.,70,bastian-dr-hans-im-schnokeloch
comedy,Löjel,M,taverner/innkeeper,service_and_sales,lower_middle_class,"Na, der Storik isch noch nit g'storwe.",70,bastian-dr-hans-im-schnokeloch
comedy,Lehn,F,,,,Ihr kämte mer grad erecht.,70,bastian-dr-hans-im-schnokeloch
comedy,Hans,M,large_farmer,agriculture,upper_middle_class,"s'Unglück isch nim guet ze mache. Ich, ich wo mich so gfrait hab uff e Bue. Ach, mini Frau isch an allem Schuld.",70,bastian-dr-hans-im-schnokeloch
comedy,Urschel,F,,,,Awer Hans ! —,71,bastian-dr-hans-im-schnokeloch
comedy,Stauffert,M,skipper,industry_and_transportation,lower_middle_class,"Mache jetzt ken Flöüse. d'Hauptsach isch, dass mer gsund d'rbie bliewe, gell Hans ?",71,bastian-dr-hans-im-schnokeloch
comedy,Hans,M,large_farmer,agriculture,upper_middle_class,"Ach, Welt, Welt !",71,bastian-dr-hans-im-schnokeloch
comedy,Lehn,F,,,,"He, ihr Kinder, mache d'r Hof süüfer. Alle, ihr Litt, nyn in Stubb, ihr Maidle mache's euch comod.",71,bastian-dr-hans-im-schnokeloch
comedy,Gerôme,M,veterinary,professionals_scientific_technical,upper_middle_class,"Do, ihr Kneckes, als los|||— als los!",71,bastian-dr-hans-im-schnokeloch
comedy,Löjel,M,taverner/innkeeper,service_and_sales,lower_middle_class,"Stauffert, langsam, wo witt dü anne ?",71,bastian-dr-hans-im-schnokeloch
comedy,Stauffert,M,skipper,industry_and_transportation,lower_middle_class,"Ich muess zue mim Gänselspiel — es wurd gschtösselt hitt un ohne d'r Präsident geht's nit. Aladanda salübisamme, amesiere euch guet.",71,bastian-dr-hans-im-schnokeloch
comedy,Jüstinel,F,,,,Adie Babbe ! Kummsch widder ?,71,bastian-dr-hans-im-schnokeloch
comedy,Stauffert,M,skipper,industry_and_transportation,lower_middle_class,Uffgebasst un nit gelacht|||.,71,bastian-dr-hans-im-schnokeloch
comedy,Knabe,M,,,,Guete Daa bienand.,71,bastian-dr-hans-im-schnokeloch
comedy,Hans,M,large_farmer,agriculture,upper_middle_class,Was witt dü Kneckes ?,71,bastian-dr-hans-im-schnokeloch
comedy,Knabe,M,,,,"Ich hab ghört, d'r Hans im Schnokeloch hett Kinddaif un do hawi gedenkt, s'könnt Zuckerköjele genn.",71,bastian-dr-hans-im-schnokeloch
comedy,Gerôme,M,veterinary,professionals_scientific_technical,upper_middle_class,Wo kummsch denn here ?,72,bastian-dr-hans-im-schnokeloch
comedy,Knabe,M,,,,Im Rhinwäldel hawi Meise gelockt,72,bastian-dr-hans-im-schnokeloch
comedy,Hans,M,large_farmer,agriculture,upper_middle_class,Meise un Brandele ?,72,bastian-dr-hans-im-schnokeloch
comedy,Knabe,M,,,,Will Er si aakaufe?,72,bastian-dr-hans-im-schnokeloch
comedy,Gerôme,M,veterinary,professionals_scientific_technical,upper_middle_class,Was fresst denn so e Meis ?,72,bastian-dr-hans-im-schnokeloch
comedy,Knabe,M,,,,Jede Daa e Nuss.,72,bastian-dr-hans-im-schnokeloch
comedy,Löjel,M,taverner/innkeeper,service_and_sales,lower_middle_class,"Was, jede Daa e Nuss ?",72,bastian-dr-hans-im-schnokeloch
comedy,Hans,M,large_farmer,agriculture,upper_middle_class,"Hundert Daa, hundert Nusse, mach mer die Meis zuem Hüs nüss.",72,bastian-dr-hans-im-schnokeloch
comedy,Gerôme,M,veterinary,professionals_scientific_technical,upper_middle_class,Kennsch dü zell Liedel vum Rhinwäldel ?,72,bastian-dr-hans-im-schnokeloch
comedy,Knabe,M,,,,"Au noch ! — z'Erscht will ich Zuckerköjele, no loss ich mit mer redde.",72,bastian-dr-hans-im-schnokeloch
comedy,Hans,M,large_farmer,agriculture,upper_middle_class,Wenn ich eso e Bue hätt. Gerôme Do hesch e Hampfl.,72,bastian-dr-hans-im-schnokeloch
comedy,Knabe,M,,,,"Haha, merci.|||Jetzt geht's in's Rhinwäldel|||In's Lerchefeldel ;|||Fange Ziesele, Blöjele, Brandle genue,|||Wer jo ken Meise lockt,|||Isch au ken Bue.|||Wurd mer halt älter,|||Hett Alles e n-End ;|||Verkauft mer de Käffi|||Un d'Liemruet verbrennt.|||No geht's in's Kränzel,|||Mer macht e christlich Dänzel|||Mit-em Wiesele, Gretele, Soferle dr'zue.|||Wer jo ken Maidle schmutzt|||Isch au ken Bue.",72,bastian-dr-hans-im-schnokeloch
comedy,Gerôme,M,veterinary,professionals_scientific_technical,upper_middle_class,"Wer jo ken Maidle schmutzt, Isch au ken Bue! — Brav! Bürschtel, dü hesch din Sach guet gemacht, do hesch noch vier Leitsche, trabb ab.",73,bastian-dr-hans-im-schnokeloch
comedy,Knabe,M,,,,"Merci, salue bien|||.|||Storik, Storik, stibber dini Baan,|||Bring d'r Mamme e Bubbele haam.",73,bastian-dr-hans-im-schnokeloch
comedy,Hans,M,large_farmer,agriculture,upper_middle_class,Awer ken Maidel !,73,bastian-dr-hans-im-schnokeloch
comedy,Lehn,F,,,,"Alle hopp, ihr Litt, firschi eryn.",73,bastian-dr-hans-im-schnokeloch
comedy,Urschel,F,,,,"Hans, Hansele !|||So, s'isch' so guet in d'r Luft.|||Nina, Bubbele, Koch im Kind e Subbele,|||Schlaaue-n-em au e Gaggele drin,|||Bringe-n-em au e Schöbbele Wyn.|||Hans, geh doch au nyn. Lüej doch nit sa betrübt. Hans!|||Horch, s'isch e Brief kumme vun dim ami François üss Amerika",73,bastian-dr-hans-im-schnokeloch
comedy,Hans,M,large_farmer,agriculture,upper_middle_class,"E Brief vum — gieb here, zaj. Er sitzt in Amerika un ich — ich gschlaauener Mensch — sitz do. — Sitter dass'r furt isch, fehlt mer ebbs.",73,bastian-dr-hans-im-schnokeloch
comedy,Urschel,F,,,,"Goldhansel, wie kannsch nur so redde. Ich hab dich so lieb",73,bastian-dr-hans-im-schnokeloch
comedy,Hans,M,large_farmer,agriculture,upper_middle_class,"Vun Amerika, vum Wunderland, wo d'Affe mit Goggelsnusse Balles spiele. François, wenn dü wisse dätsch, dass ich e Maidel hab, statt e Bue. O, diss vexiert !",73,bastian-dr-hans-im-schnokeloch
comedy,Urschel,F,,,,"Hansel, ich kann jo leider nix d'rvor, dass d'r Storik s'verwechselt hett.",73,bastian-dr-hans-im-schnokeloch
comedy,Hans,M,large_farmer,agriculture,upper_middle_class,"Er schriebt, er isch glüecklich, geht uff d'Löwejagd, er müsiziert un — wenn ich numme aan Daa biem könnt sin, saat'r. Halt, was steht do? — Wie geht's d'r dü armer Tropf — ach Gott — armer Tropf, schriebt'r aunoch — un — wass? Ich krej nächstens e garçon|||So e Lewe — do möcht mer kapüt gehn, e garçon.",73,bastian-dr-hans-im-schnokeloch
comedy,Urschel,F,,,,"Jo, er maant e garçon zuem Serviere.",73,bastian-dr-hans-im-schnokeloch
comedy,Hans,M,large_farmer,agriculture,upper_middle_class,"Naan — naan — o Amerika, liberté.",73,bastian-dr-hans-im-schnokeloch
comedy,Urschel,F,,,,"Awer, Hans, hitt wo Kinddaif isch, do isch mer lusti, un ken Essigkrüej wie dü. Hans kumm",74,bastian-dr-hans-im-schnokeloch
comedy,Lehn,F,,,,"Aha, schun widder verliebt wie|||e Mohr in e Schibüs. Ich hab alli Händ voll ze duehn un ihr mache ganz zitt",74,bastian-dr-hans-im-schnokeloch
comedy,Urschel,F,,,,"Ich kumm, Dante — ich — Hans, geh nyn zue dine Gäst",74,bastian-dr-hans-im-schnokeloch
comedy,Hans,M,large_farmer,agriculture,upper_middle_class,"Naan, do bliewi — ach !",74,bastian-dr-hans-im-schnokeloch
comedy,Lehn,F,,,,"Loss 'ne Ursch, denne Kopfele|||.",74,bastian-dr-hans-im-schnokeloch
comedy,Urschel,F,,,,"Kumm Hans, hüet mer's Kind, kumm|||So, min Hansele (ab).",74,bastian-dr-hans-im-schnokeloch
